,author,created_utc,id,body,parent_id,permalink,score,subreddit,ptype,time
1473,spikyraccoon,1589176081,fq8uq9r,"Identity theft is not cool Emily. Loved the proposal, wedding and callbacks during the dance routine. The best thing to come out of quarantine by far.",t3_ghgmlc,/r/DunderMifflin/comments/ghgmlc/the_office_cast_reunite_for_zoom_wedding/fq8uq9r/,1,DunderMifflin,comment,2020-05-11
1474,MendedWaif62,1589176115,fq8urrd,Andy has been calling me “Plop” for so long he forgot my real name is Pete,t1_fq8ta8a,/r/DunderMifflin/comments/ghhegy/season_9_why_didnt_pam_and_pete_switch_desks/fq8urrd/,1,DunderMifflin,comment,2020-05-11
1475,BroccoliRob-,1589176128,fq8usa4,"I think a scene from Lord of the rings would be hilarious. Like maybe when Gandalf revealed himself as Gandalf the white. That’s just the first scene that came to mind though, lots of options!",t1_fq8mnzf,/r/DunderMifflin/comments/gherqe/my_new_hobby_is_just_putting_prison_mike_into/fq8usa4/,1,DunderMifflin,comment,2020-05-11
1476,MendedWaif62,1589176191,fq8uuzg,"I didn’t. Or at least I don’t remember getting it, I very well could have",t1_fq8rex1,/r/DunderMifflin/comments/ghh7k6/it_took_rewatching_the_office_100_times_in/fq8uuzg/,1,DunderMifflin,comment,2020-05-11
1477,SixFootThreeHobbit,1589176192,fq8uv17,Diwali? Diwali.,t3_ghhqe7,/r/DunderMifflin/comments/ghhqe7/this_picture_gives_me_so_much_nostalgia_for_no/fq8uv17/,1,DunderMifflin,comment,2020-05-11
1478,Fanofthebrix,1589176204,fq8uviw,"NOOOO, noooo god no, it’s Toby.",t1_fq8tc6w,/r/DunderMifflin/comments/euuzdf/finally_finished_the_office_lego_with_all_the/fq8uviw/,1,DunderMifflin,comment,2020-05-11
1479,aria1991234,1589176210,fq8uvtw,David Wallace was such a great character addition. He played the part flawlessly and was genuinely such a good guy. Andy Buckley is fantastic.,t3_ghfxui,/r/DunderMifflin/comments/ghfxui/always_loved_this_scene_michael_cared_more_about/fq8uvtw/,1,DunderMifflin,comment,2020-05-11
1480,Everett_LoL,1589176256,fq8uxv0,Pam is such a cry baby tho. She failed at everything so she can’t have Jim being successful. Oh no.,t3_ghhs96,/r/DunderMifflin/comments/ghhs96/lol/fq8uxv0/,1,DunderMifflin,comment,2020-05-11
1481,PixelatedFractal,1589176367,fq8v2pd,"I'm fully convinced that anyone who raves about the office, parks and rec, Brooklyn 99, or any show associated with Lorne Michael's has severe depression and LCD taste.",t3_ggyxd6,/r/DunderMifflin/comments/ggyxd6/it_has_made_quarantine_a_lot_easier/fq8v2pd/,1,DunderMifflin,comment,2020-05-11
1482,spikyraccoon,1589176388,fq8v3mi,"If I had regular Jenna fischer at my office without makeup, I'd still be crazy into her.",t1_fq8u0tv,/r/DunderMifflin/comments/ghgmlc/the_office_cast_reunite_for_zoom_wedding/fq8v3mi/,1,DunderMifflin,comment,2020-05-11
1483,moseisthebest,1589176414,fq8v4qv,Yes but difference between Angela and Pam is Angela is stern and takes no crap from no one Pam is the opposite of her,t3_ghhs96,/r/DunderMifflin/comments/ghhs96/lol/fq8v4qv/,1,DunderMifflin,comment,2020-05-11
1484,321nairda,1589176484,fq8v7t0,All I needed was creed,t3_ghh1qn,/r/DunderMifflin/comments/ghh1qn/the_office_cast_reunites_for_zoom_wedding/fq8v7t0/,1,DunderMifflin,comment,2020-05-11
1485,thinkmyfavoritesong,1589176525,fq8v9jp,I’m rejecting your kiss...,t3_ghhqe7,/r/DunderMifflin/comments/ghhqe7/this_picture_gives_me_so_much_nostalgia_for_no/fq8v9jp/,1,DunderMifflin,comment,2020-05-11
1486,MendedWaif62,1589176553,fq8vas5,"I hate Prince Family Paper more. A LOT MORE. It didn’t seem like something Michael would do, Scott’s Tots may be cringy but at least it fits the character",t3_ghgk2h,/r/DunderMifflin/comments/ghgk2h/i_think_something_is_wrong_with_my_friend/fq8vas5/,1,DunderMifflin,comment,2020-05-11
1487,Mr_Mandrill,1589176563,fq8vb8u,"That was so cool. I think I was more excited and emotional than the couple getting married, tho.",t3_ghgmlc,/r/DunderMifflin/comments/ghgmlc/the_office_cast_reunite_for_zoom_wedding/fq8vb8u/,1,DunderMifflin,comment,2020-05-11
1488,space_bootz,1589176607,fq8vd1i,My kinda evening 🥰,t3_ghhw3l,/r/DunderMifflin/comments/ghhw3l/sunday_night/fq8vd1i/,1,DunderMifflin,comment,2020-05-11
1489,mjaga93,1589176695,fq8vgue,And Prison Mike. How could you have a GTA cover of Office and not have Prison Mike.,t1_fq85q75,/r/DunderMifflin/comments/ghdkva/thank_you_to_whomever_posted_this_earlier_my_son/fq8vgue/,1,DunderMifflin,comment,2020-05-11
1490,RandomArgentino,1589176745,fq8vizz,"Well, I think that this isn’t as cringe as other moments because the awkwardness wasn’t Holly’s fault, she legitimately believed Kevin to be retarded.",t3_gh9k7g,/r/DunderMifflin/comments/gh9k7g/wait_do_you_think_im_retarded/fq8vizz/,1,DunderMifflin,comment,2020-05-11
1491,michael-g-scott-bot,1589176805,fq8vlh9,There are no movies in prison.,t1_fq8vgue,/r/DunderMifflin/comments/ghdkva/thank_you_to_whomever_posted_this_earlier_my_son/fq8vlh9/,1,DunderMifflin,comment,2020-05-11
1492,thinkmyfavoritesong,1589176836,fq8vmt7,This made me cry ❤️John is awesome for putting this all together,t3_ghh1qn,/r/DunderMifflin/comments/ghh1qn/the_office_cast_reunites_for_zoom_wedding/fq8vmt7/,1,DunderMifflin,comment,2020-05-11
1493,2025tech2025,1589176876,fq8vohb,This,t1_fq8uxv0,/r/DunderMifflin/comments/ghhs96/lol/fq8vohb/,1,DunderMifflin,comment,2020-05-11
1494,blitzskrieg,1589176927,fq8vqo2,I lost it at Rain kicking his wife in the face.,t3_ghh1qn,/r/DunderMifflin/comments/ghh1qn/the_office_cast_reunites_for_zoom_wedding/fq8vqo2/,1,DunderMifflin,comment,2020-05-11
1495,captain_charbosa,1589176969,fq8vsdy,"Yeah okay... well this is gunna hurt like a mother f****r
😢",t3_ghhl57,/r/DunderMifflin/comments/ghhl57/the_office_cast_reunites_for_zoom_wedding_sgnlove/fq8vsdy/,1,DunderMifflin,comment,2020-05-11
1496,Dwigt_Schroot,1589176982,fq8vsxy,This was great!,t3_ghhl57,/r/DunderMifflin/comments/ghhl57/the_office_cast_reunites_for_zoom_wedding_sgnlove/fq8vsxy/,1,DunderMifflin,comment,2020-05-11
1497,singinglaundromat,1589177063,fq8vwai,"This is so sweet.

And oh my god how is Steve Carell getting hotter?",t3_ghhl57,/r/DunderMifflin/comments/ghhl57/the_office_cast_reunites_for_zoom_wedding_sgnlove/fq8vwai/,1,DunderMifflin,comment,2020-05-11
1498,PrimalNumber,1589177281,fq8w5b5,What a shit thing to say about her/him/them based on a harmless photo.,t3_ghh4sz,/r/DunderMifflin/comments/ghh4sz/hold_up/fq8w5b5/,1,DunderMifflin,comment,2020-05-11
1499,collin-zwart,1589177400,fq8wa8u,"I’ll watch literally anything with Steve in it, although the trailer doesn’t give me high hopes. Maybe it’s just the style of comedy clashing with the style of comedy we expect from Steve that makes the trailer feel off.",t3_ge4w7x,/r/DunderMifflin/comments/ge4w7x/space_force_discussion_thread/fq8wa8u/,1,DunderMifflin,comment,2020-05-11
1500,B10wM3,1588308634,fp4vpty,"&gt; The upvotes doubled my karma. Thanks everyone

/r/AwardSpeechEdits and you didn't even get an award lol",t1_fp2wpdd,/r/DunderMifflin/comments/gb0he5/if_you_dont_understand_it_ask_in_comments/fp4vpty/,1,DunderMifflin,comment,2020-05-01
1501,moldren,1588308694,fp4vsnh,"I think Clint Eastwood would have made a fine Kevin.

Alan Resnick as Stanley. 

Rosanne is Angela

Jason Alexander as Jim.

Christopher Lee for Dwight, obviously.

Danny Glover as Ryan.

Liza Minnelli as Pam

Sylvester Stalone is Oscar.

I think that's all of them.",t3_gb9twr,/r/DunderMifflin/comments/gb9twr/i_know_saying_this_is_a_cardinal_sin_but_if_the/fp4vsnh/,1,DunderMifflin,comment,2020-05-01
1502,meadowiguana,1588308717,fp4vtr4,You’re the most important thing in my life right now. Happy cake day,t3_gbahox,/r/DunderMifflin/comments/gbahox/justin_time/fp4vtr4/,3,DunderMifflin,comment,2020-05-01
1503,Baked-Patato,1588308779,fp4vwmw,You get me,t1_fp4vmv1,/r/DunderMifflin/comments/gbbqar/i_just_noticed_that_during_jims_interview_with/fp4vwmw/,3,DunderMifflin,comment,2020-05-01
1504,Pyrsec,1588308824,fp4vyqg,Your wife becoming me will I,t1_fp4vwmw,/r/DunderMifflin/comments/gbbqar/i_just_noticed_that_during_jims_interview_with/fp4vyqg/,3,DunderMifflin,comment,2020-05-01
1505,A-Little-Stitious78,1588308855,fp4w06q,Jenna Fischer (Pam) liked a comment.,t1_fp3pi45,/r/DunderMifflin/comments/gavdf6/something_so_simple_can_really_make_your_day/fp4w06q/,1,DunderMifflin,comment,2020-05-01
1506,JustAnotherMark604,1588308877,fp4w18w,"OP 

Why are you the way that you are? Honestly, every time I try to do something fun or exciting, you make it not that way. I hate so much about the things that you choose to be.",t3_gbbmzy,/r/DunderMifflin/comments/gbbmzy/can_we_please_start_a_thread_on_how_great_of/fp4w18w/,15,DunderMifflin,comment,2020-05-01
1507,moldren,1588308924,fp4w3h6,She's actually a 78 year old white albino woman in real life.  Switching make-up artists throughout the series almost made me stop watching.,t3_gb9h90,/r/DunderMifflin/comments/gb9h90/kelly_kapoor/fp4w3h6/,2,DunderMifflin,comment,2020-05-01
1508,3pinephrine,1588308926,fp4w3lg,I feel attacked,t3_gb8mf0,/r/DunderMifflin/comments/gb8mf0/cough_cough_the_office_cough_cough/fp4w3lg/,2,DunderMifflin,comment,2020-05-01
1509,cbaek,1588308947,fp4w4j2,"Got to give it to him, he’s got made hops. The way he cleared that fence man",t3_gbbmzy,/r/DunderMifflin/comments/gbbmzy/can_we_please_start_a_thread_on_how_great_of/fp4w4j2/,4,DunderMifflin,comment,2020-05-01
1510,ChillybeanA59,1588308956,fp4w4xg,No,t3_gba4ix,/r/DunderMifflin/comments/gba4ix/the_office_did_jim_cheat_on_pam_with_cathy/fp4w4xg/,2,DunderMifflin,comment,2020-05-01
1511,mildly_demonic,1588308972,fp4w5qc,That’s just a fan-made theory,t1_fp0ve96,/r/DunderMifflin/comments/gao7c5/wait/fp4w5qc/,1,DunderMifflin,comment,2020-05-01
1512,Baked-Patato,1588309032,fp4w8k9,We’re moving to Colorado,t1_fp4vyqg,/r/DunderMifflin/comments/gbbqar/i_just_noticed_that_during_jims_interview_with/fp4w8k9/,2,DunderMifflin,comment,2020-05-01
1513,Pyrsec,1588309079,fp4warn,"All of us?

Holly doesnt say anything so gotta switch to Kev",t1_fp4w8k9,/r/DunderMifflin/comments/gbbqar/i_just_noticed_that_during_jims_interview_with/fp4warn/,3,DunderMifflin,comment,2020-05-01
1514,The1KrisRoB,1588309131,fp4wd5n,no,t3_gbbmzy,/r/DunderMifflin/comments/gbbmzy/can_we_please_start_a_thread_on_how_great_of/fp4wd5n/,1,DunderMifflin,comment,2020-05-01
1515,cptspacetime,1588309167,fp4wev7,I begged you to be chuck,t1_fp4f38i,/r/DunderMifflin/comments/gb8yt5/when_i_was_younger_i_thought_the_two_were_the/fp4wev7/,1,DunderMifflin,comment,2020-05-01
1516,MaterialAnalyst8,1588309179,fp4wff2,Same here I always skip that scene but I watch all of Scott’s tots,t1_fp317s0,/r/DunderMifflin/comments/gay9dc/forget_scotts_tots_this_is_the_cringiest_moment/fp4wff2/,2,DunderMifflin,comment,2020-05-01
1517,michael-g-scott-bot,1588309205,fp4wgo3,"Ohh, I do not have much time... to tell you what I have to tell you. And just bear in mind when I say... say these things, that... are bad things... that you hear... in your ears... this is something that I, if I were you, that I wouldn't want to hear...",t1_fp4v3b7,/r/DunderMifflin/comments/gb4t44/best_jan_moment/fp4wgo3/,6,DunderMifflin,comment,2020-05-01
1518,BrokenHorseLegs,1588309219,fp4whd5,We all hate Toby because deep down... We're all Toby.,t3_gbbmzy,/r/DunderMifflin/comments/gbbmzy/can_we_please_start_a_thread_on_how_great_of/fp4whd5/,8,DunderMifflin,comment,2020-05-01
1519,joy4874,1588309220,fp4whe5,Stay out of Argentina,t3_gbbgv1,/r/DunderMifflin/comments/gbbgv1/that_damn_shoah_foundation/fp4whe5/,1,DunderMifflin,comment,2020-05-01
1520,pmboobs001,1588309230,fp4whuw,My wife is an English teacher and I showed her this and she was so disappointed in me.,t1_fp4nmyv,/r/DunderMifflin/comments/gb0he5/if_you_dont_understand_it_ask_in_comments/fp4whuw/,1,DunderMifflin,comment,2020-05-01
1521,Jason-Casey-Art,1588309239,fp4wibg,I was fine with him until he tried sabotaging Jim's career at Dunder Mifflin because of his jealously over Pam.,t3_gbbmzy,/r/DunderMifflin/comments/gbbmzy/can_we_please_start_a_thread_on_how_great_of/fp4wibg/,5,DunderMifflin,comment,2020-05-01
1522,ArtisticGuy,1588309249,fp4wiqb,"Google ""beard"". There are other meanings.",t1_fp4vefs,/r/DunderMifflin/comments/gb0he5/if_you_dont_understand_it_ask_in_comments/fp4wiqb/,1,DunderMifflin,comment,2020-05-01
1523,AutoModerator,1588309269,fp4wjo6,"Hey chocothegoat! Your submission has been automatically removed due to a minimum age requirement on your Reddit account. Your account must be at least an hour old to post to the subreddit.

*I am a bot, and this action was performed automatically. Please [contact the moderators of this subreddit](/message/compose/?to=/r/DunderMifflin) if you have any questions or concerns.*",t3_gbbz67,/r/DunderMifflin/comments/gbbz67/did_you_guys_ever_notice_this_in_the_background/fp4wjo6/,1,DunderMifflin,comment,2020-05-01
1524,ankesh162,1588309277,fp4wk0e,The venue issues.,t1_foxnrd0,/r/DunderMifflin/comments/ga41oo/everytime/fp4wk0e/,1,DunderMifflin,comment,2020-05-01
1525,YeahImAMan,1588309295,fp4wkv5,This is delightful,t3_gb0he5,/r/DunderMifflin/comments/gb0he5/if_you_dont_understand_it_ask_in_comments/fp4wkv5/,1,DunderMifflin,comment,2020-05-01
1526,t-smith_07,1588309380,fp4wowl,Well you have to tell us the top two now...,t3_gbbzpd,/r/DunderMifflin/comments/gbbzpd/just_finished_the_office_about_2_minutes_ago/fp4wowl/,4,DunderMifflin,comment,2020-05-01
1527,Majorly_Concerned,1588309443,fp4wrs3,What could possibly be your top two,t3_gbbzpd,/r/DunderMifflin/comments/gbbzpd/just_finished_the_office_about_2_minutes_ago/fp4wrs3/,1,DunderMifflin,comment,2020-05-01
1528,MaterialAnalyst8,1588309470,fp4wt1s,I think he purposely put it in because post Malone and Kevin Malone,t1_fp2y2w5,/r/DunderMifflin/comments/gazy7k/rip_kevins_chilli/fp4wt1s/,4,DunderMifflin,comment,2020-05-01
1529,dkrtzyrrr,1588309477,fp4wtci,"just watched this episode (again). jim and ryan are locks, kelly makes a lot of sense even before you get into how angela feels about her. phyllis makes sense for the fourth - he sits near her which means he gets annoyed by her perfume or grinding her teeth - but i think kevin is the fourth.",t3_fnx1pc,/r/DunderMifflin/comments/fnx1pc/in_s2_e20_dwight_says_he_likes_his_co_workers/fp4wtci/,1,DunderMifflin,comment,2020-05-01
1530,Jason-Casey-Art,1588309498,fp4wubz,Why are you like this?,t3_gb59m1,/r/DunderMifflin/comments/gb59m1/what_if_everyone_was_toby/fp4wubz/,1,DunderMifflin,comment,2020-05-01
1531,DizzySpheres,1588309568,fp4wxhj,Sorry I'm downvoting this because *Toby's the worst!*,t3_gbbmzy,/r/DunderMifflin/comments/gbbmzy/can_we_please_start_a_thread_on_how_great_of/fp4wxhj/,3,DunderMifflin,comment,2020-05-01
1532,DyonisosUSA,1588309571,fp4wxna,Would love to know what’s number 1 :o,t3_gbbzpd,/r/DunderMifflin/comments/gbbzpd/just_finished_the_office_about_2_minutes_ago/fp4wxna/,1,DunderMifflin,comment,2020-05-01
1533,IamFuzzyWuzzy,1588309587,fp4wyf2,C World,t3_gbbz2i,/r/DunderMifflin/comments/gbbz2i/did_kevin_mean_sea_world_or_see_the_world/fp4wyf2/,6,DunderMifflin,comment,2020-05-01
1534,CRAPLICKERRR,1588309625,fp4x07u,"I hate his face! I wanna smash it. 
Trying to be friends with him is like trying to be friends with an evil snail.",t3_gbbmzy,/r/DunderMifflin/comments/gbbmzy/can_we_please_start_a_thread_on_how_great_of/fp4x07u/,4,DunderMifflin,comment,2020-05-01
1535,teslasneakthief,1588309680,fp4x2py,That’s not a sister. That’s a monster.,t3_gbb2tq,/r/DunderMifflin/comments/gbb2tq/my_sister_decided_to_cancel_the_netflix/fp4x2py/,2,DunderMifflin,comment,2020-05-01
1536,super_common_name,1588309724,fp4x4r6,"Wait, what? All this time I thought it was Athlead.",t1_fp4uig6,/r/DunderMifflin/comments/gaufyj/our_new_pup_dunder_the_kids_call_him_dundie/fp4x4r6/,1,DunderMifflin,comment,2020-05-01
1537,nemo_noboby,1588309791,fp4x7vv,"Thank you, why did they delete it it's so wholesome and fun",t1_fp4s3xk,/r/DunderMifflin/comments/gb0he5/if_you_dont_understand_it_ask_in_comments/fp4x7vv/,5,DunderMifflin,comment,2020-05-01
1538,WalkerGreeen,1588309800,fp4x8a0,stick with it. please. the show is still very very good.,t3_gbc2yw,/r/DunderMifflin/comments/gbc2yw/so_i_got_up_to_the_part_of_the_office_where/fp4x8a0/,8,DunderMifflin,comment,2020-05-01
1539,UWCG,1588309861,fp4xb0w,"[I believe this is the clip you mean](https://getyarn.io/yarn-clip/649cec38-4d50-4932-b522-73c8f551c57f) one of my favorites, too.",t1_fp4vo2f,/r/DunderMifflin/comments/gbbmzy/can_we_please_start_a_thread_on_how_great_of/fp4xb0w/,2,DunderMifflin,comment,2020-05-01
1540,a-Sociopath,1588309866,fp4xb8t,"When Jim took a break for an year and stayed in Scranton, the company was renamed as Athleap.",t1_fp4x4r6,/r/DunderMifflin/comments/gaufyj/our_new_pup_dunder_the_kids_call_him_dundie/fp4xb8t/,2,DunderMifflin,comment,2020-05-01
1541,super_common_name,1588310038,fp4xj0g,I'm not sure that's much better...,t1_fp4xb8t,/r/DunderMifflin/comments/gaufyj/our_new_pup_dunder_the_kids_call_him_dundie/fp4xj0g/,1,DunderMifflin,comment,2020-05-01
1542,Belikedis,1588310080,fp4xkvu,Oceans. Fish. Jump. China.,t3_gbbz2i,/r/DunderMifflin/comments/gbbz2i/did_kevin_mean_sea_world_or_see_the_world/fp4xkvu/,4,DunderMifflin,comment,2020-05-01
1543,a-Sociopath,1588310125,fp4xmxx,Should have been called Jim and the Zits from the beginning.,t1_fp4xj0g,/r/DunderMifflin/comments/gaufyj/our_new_pup_dunder_the_kids_call_him_dundie/fp4xmxx/,2,DunderMifflin,comment,2020-05-01
1544,professorurie,1588310146,fp4xnw5,"Don't worry about Will Ferrel, do you like Basketball?",t3_gbc2yw,/r/DunderMifflin/comments/gbc2yw/so_i_got_up_to_the_part_of_the_office_where/fp4xnw5/,5,DunderMifflin,comment,2020-05-01
1545,bexxsterss,1588310280,fp4xtx1,That's my favorite one,t3_gbc5hw,/r/DunderMifflin/comments/gbc5hw/i_didnt_see_you_behind_that_grain_of_rice_boom/fp4xtx1/,2,DunderMifflin,comment,2020-05-01
1546,NotoriousAnonymity,1588310287,fp4xuaa,Oy...,t1_fp4rlr6,/r/DunderMifflin/comments/gbb3ug/i_made_this_while_in_an_on_going_conversation/fp4xuaa/,3,DunderMifflin,comment,2020-05-01
1547,swingman06,1588310291,fp4xugg," If I had a gun with two bullets, and I was in a room with Hitler, bin-Laden, and Toby, I would shoot Toby twice.",t3_gbbmzy,/r/DunderMifflin/comments/gbbmzy/can_we_please_start_a_thread_on_how_great_of/fp4xugg/,3,DunderMifflin,comment,2020-05-01
1548,sHaDoWhUnTeRx76,1588310334,fp4xwe1,"You can tell what’s happening visually based on the dialogue after a few rewatches, great for getting thru a job that requires little attention but a lot of time",t1_fp4j0tp,/r/DunderMifflin/comments/gb8mf0/cough_cough_the_office_cough_cough/fp4xwe1/,4,DunderMifflin,comment,2020-05-01
1549,AJDuke3,1588310354,fp4xxd0,My thoughts exactly... Its so wholesome...,t1_fp4x7vv,/r/DunderMifflin/comments/gb0he5/if_you_dont_understand_it_ask_in_comments/fp4xxd0/,1,DunderMifflin,comment,2020-05-01
1550,Maxcalibur,1588310360,fp4xxma,"Nah, you gotta be making that one up, that's just absurd",t1_fp4h01l,/r/DunderMifflin/comments/gb0he5/if_you_dont_understand_it_ask_in_comments/fp4xxma/,1,DunderMifflin,comment,2020-05-01
1551,Marcus_Fo-Relius,1588310398,fp4xzaw,Me no wste mny lttrs wen few do trck. Kevin lyk c things. Kvn lyk wrld. Kvn like trvl. So he say he c wrld.,t3_gbbz2i,/r/DunderMifflin/comments/gbbz2i/did_kevin_mean_sea_world_or_see_the_world/fp4xzaw/,1,DunderMifflin,comment,2020-05-01
1552,AnkiAnki33,1588310452,fp4y1qs,Not her fault she was tight on money and it’s her money,t1_fp4x2py,/r/DunderMifflin/comments/gbb2tq/my_sister_decided_to_cancel_the_netflix/fp4y1qs/,2,DunderMifflin,comment,2020-05-01
1553,pickle_geuse,1588310544,fp4y5w7,YES and I can’t tell you how last week I couldn’t decide on anything and watched three hours of different Caribbean recipes on YouTube. Like. What?,t1_fp4u22f,/r/DunderMifflin/comments/gb8mf0/cough_cough_the_office_cough_cough/fp4y5w7/,2,DunderMifflin,comment,2020-05-01
1554,teslasneakthief,1588310546,fp4y5zr,Definitely. I was just being silly lol,t1_fp4y1qs,/r/DunderMifflin/comments/gbb2tq/my_sister_decided_to_cancel_the_netflix/fp4y5zr/,2,DunderMifflin,comment,2020-05-01
1555,Bloopson224,1588310601,fp4y8go,Might as well restart the series now because its just a slow decline from now on,t3_gbc2yw,/r/DunderMifflin/comments/gbc2yw/so_i_got_up_to_the_part_of_the_office_where/fp4y8go/,-1,DunderMifflin,comment,2020-05-01
1556,Stormageddon18,1588310616,fp4y93s,"I just finished it for like the 7th time less then a hour ago, I don’t watch it with my full attention tho it’s mainly for background noise lol",t3_gbbzpd,/r/DunderMifflin/comments/gbbzpd/just_finished_the_office_about_2_minutes_ago/fp4y93s/,3,DunderMifflin,comment,2020-05-01
1557,Malvicioalavena,1588310616,fp4y94g,"Similar story here. I watched a few times but didnt think it was that good. One day, at a friends house while someking weed we catched on tv that episode where michael invited jim, pam, angela and andy for dinner with jan as his co-host. Best episode of a comedy series ever made, brutal. Then I watched 12 times the whole show, and yes, season 8 and 9 half the times. I just miss michael too much to actually enjoy it.",t1_fp4tw11,/r/DunderMifflin/comments/gb8mf0/cough_cough_the_office_cough_cough/fp4y94g/,4,DunderMifflin,comment,2020-05-01
1558,felixbunny,1588310632,fp4y9ux,"Op, you are like an evil snail.",t3_gbbmzy,/r/DunderMifflin/comments/gbbmzy/can_we_please_start_a_thread_on_how_great_of/fp4y9ux/,4,DunderMifflin,comment,2020-05-01
1559,Bhuvan3,1588310667,fp4ybel,How to set a background like this?,t3_gb3z7k,/r/DunderMifflin/comments/gb3z7k/my_zoom_background_for_today/fp4ybel/,1,DunderMifflin,comment,2020-05-01
1560,Douchebigalo973,1588310765,fp4yfqf,You should be ashamed.,t1_fp4v2ec,/r/DunderMifflin/comments/gbbqar/i_just_noticed_that_during_jims_interview_with/fp4yfqf/,1,DunderMifflin,comment,2020-05-01
1561,Bird32985,1588310783,fp4ygjh,"Good news, he was released with no charges!",t3_gbcage,/r/DunderMifflin/comments/gbcage/a_big_fan_on_livepd/fp4ygjh/,5,DunderMifflin,comment,2020-05-01
1562,namresaw33,1588310789,fp4ygts,Maybe paper should be more of a hobby for you...,t3_gbahox,/r/DunderMifflin/comments/gbahox/justin_time/fp4ygts/,2,DunderMifflin,comment,2020-05-01
1563,DisgruntledAardvark,1588310827,fp4yig4,The worst thing you can do for your immune system is to coddle it.,t1_fp4gcrl,/r/DunderMifflin/comments/gb8mf0/cough_cough_the_office_cough_cough/fp4yig4/,5,DunderMifflin,comment,2020-05-01
1564,215Kurt,1588310880,fp4ykrk,"everytime i watch it, my cheeks hurt from smiling so much.

it's an incredibly wholesome moment that really shows that the accounting trio really does care about each other (i know oscar isn't in this scene but still) and has always cared about each other as this was seasons before angela even met the senator.",t1_fp4x7vv,/r/DunderMifflin/comments/gb0he5/if_you_dont_understand_it_ask_in_comments/fp4ykrk/,2,DunderMifflin,comment,2020-05-01
1565,oh_spookish,1588311014,fp4yqom,Gay =/= weak,t1_fp4vjjw,/r/DunderMifflin/comments/gb0he5/if_you_dont_understand_it_ask_in_comments/fp4yqom/,1,DunderMifflin,comment,2020-05-01
1566,thatguywithaleg,1588311079,fp4ytju,Which episode is that?,t3_gasmpn,/r/DunderMifflin/comments/gasmpn/just_draw_triangle/fp4ytju/,1,DunderMifflin,comment,2020-05-01
1567,T-1993,1588311151,fp4ywr2,"He was probably at a sporting event and… saw some people pushing each other, and he intervened.",t3_gbcage,/r/DunderMifflin/comments/gbcage/a_big_fan_on_livepd/fp4ywr2/,4,DunderMifflin,comment,2020-05-01
1568,Mr_Mike752,1588311331,fp4z4mx,Jimothy hapert,t3_gb46d6,/r/DunderMifflin/comments/gb46d6/guess_the_office_character_by_the_emoji_day_1/fp4z4mx/,1,DunderMifflin,comment,2020-05-01
1569,YelnatstreboR,1588311345,fp4z5al,Is that the HR guy that Toby was talking to at the company picnic?,t3_gbbqar,/r/DunderMifflin/comments/gbbqar/i_just_noticed_that_during_jims_interview_with/fp4z5al/,3,DunderMifflin,comment,2020-05-01
1570,JustAnotherMark604,1588311372,fp4z6df,Toby is the reason why the writers gave Jerry Gergich such a good life,t3_gbbmzy,/r/DunderMifflin/comments/gbbmzy/can_we_please_start_a_thread_on_how_great_of/fp4z6df/,4,DunderMifflin,comment,2020-05-01
1571,Wishiwascro,1588311394,fp4z7br,The pink shirt purple jacket looks very pammy,t3_gb8yqd,/r/DunderMifflin/comments/gb8yqd/erin_always_surprises/fp4z7br/,1,DunderMifflin,comment,2020-05-01
1572,IgneEtSanguis,1588311455,fp4z9ye,I LOVE the smile he does right after,t1_fp4u89o,/r/DunderMifflin/comments/gb4t44/best_jan_moment/fp4z9ye/,2,DunderMifflin,comment,2020-05-01
1573,imogensumbar,1588311537,fp4zdiw,Date mike is so cringe!!,t1_fp23cxp,/r/DunderMifflin/comments/gavhgw/i_didnt_mind_scotts_tots_episode/fp4zdiw/,1,DunderMifflin,comment,2020-05-01
1574,fumbling_moron,1588311576,fp4zf9p,Didn't understand the senator angela one...,t3_gb0he5,/r/DunderMifflin/comments/gb0he5/if_you_dont_understand_it_ask_in_comments/fp4zf9p/,2,DunderMifflin,comment,2020-05-01
1575,aforementionedapples,1588311591,fp4zfyr,"I've never been a movie person. Instead of spending two hours of my day watching one, I'd much rather commit that time doing one or more of the following...

- Listen to music
- Play a musical instrument
- Play a video game
- Go down a YouTube rabbit hole
- Nap
- Work out
- Walk my dog to the dog park
- Dick around my phone",t1_fp4dtzx,/r/DunderMifflin/comments/gb8mf0/cough_cough_the_office_cough_cough/fp4zfyr/,1,DunderMifflin,comment,2020-05-01
1576,Wombatpickle1,1588311607,fp4zgmd,Gay mike is still better,t3_gb7sh9,/r/DunderMifflin/comments/gb7sh9/so_for_a_class_i_put_creeds_face_on_michaels_i/fp4zgmd/,1,DunderMifflin,comment,2020-05-01
1577,redzombierunning,1588311701,fp4zkok,THANK YOU FOR THIS,t1_fp4s3xk,/r/DunderMifflin/comments/gb0he5/if_you_dont_understand_it_ask_in_comments/fp4zkok/,4,DunderMifflin,comment,2020-05-01
