,author,created_utc,id,body,parent_id,permalink,score,subreddit,ptype,time
0,bespectacledbalatron,1601268587,g6xb18a,Larry!!,t1_g6x0yg9,/r/DunderMifflin/comments/j10z3s/calm_down_its_just_a_prank/g6xb18a/,2,DunderMifflin,comment,2020-09-28
1,DANGERMAN50000,1601268607,g6xb240,Still not as loud as It's Always Sunny,t3_j0wa7y,/r/DunderMifflin/comments/j0wa7y/me_every_time_the_office_intro_starts/g6xb240/,2,DunderMifflin,comment,2020-09-28
2,Consistent-Crentist,1601268736,g6xb7md,Its true,t3_j11rjl,/r/DunderMifflin/comments/j11rjl/couples_where_only_one_is_an_essential_worker_be/g6xb7md/,2,DunderMifflin,comment,2020-09-28
3,Consistent-Crentist,1601268763,g6xb8tv,The big mac idea is amazing.,t3_j12go7,/r/DunderMifflin/comments/j12go7/who_remembers_this_scene/g6xb8tv/,1,DunderMifflin,comment,2020-09-28
4,MontyMayhem23,1601268844,g6xbceh,"It gets easier, don’t worry",t3_j13s10,/r/DunderMifflin/comments/j13s10/noooooo_ahhhhh/g6xbceh/,1,DunderMifflin,comment,2020-09-28
5,Consistent-Crentist,1601268850,g6xbcmt,When I saw this I thought it was coconut penis energy drink.,t3_j12cy8,/r/DunderMifflin/comments/j12cy8/i_am_here_to_beer_you_straaaaaaight/g6xbcmt/,1,DunderMifflin,comment,2020-09-28
6,[deleted],1601268869,g6xbdfj,[deleted],t3_j12go7,/r/DunderMifflin/comments/j12go7/who_remembers_this_scene/g6xbdfj/,1,DunderMifflin,comment,2020-09-28
7,RepostSleuthBot,1601268897,g6xbemf,"I didn't find any posts that meet the matching requirements for r/DunderMifflin. 

It might be OC, it might not. Things such as JPEG artifacts and cropping may impact the results.

 This search triggered my meme filter. This enabled strict matching requirements. The closest match that did not meet the requirements [is this post](https://redd.it/hymz0h)

*Feedback? Hate? Visit r/repostsleuthbot - I'm not perfect, but you can help. Report [ [False Negative](https://www.reddit.com/message/compose/?to=RepostSleuthBot&amp;subject=False%20Negative&amp;message={""post_id"": ""j12go7"", ""meme_template"": 1956}) ]*",t1_g6xbdfj,/r/DunderMifflin/comments/j12go7/who_remembers_this_scene/g6xbemf/,1,DunderMifflin,comment,2020-09-28
8,Consistent-Crentist,1601268978,g6xbi4j,I already won the lottery I was born in the US of A baby and as a backup I have a swedish passport.,t3_j0x39q,/r/DunderMifflin/comments/j0x39q/creed_is_so_versatile/g6xbi4j/,1,DunderMifflin,comment,2020-09-28
9,michael-g-scott-bot,1601269205,g6xbrtj,Do you want your life to be better...or to be worse or to stay the same?,t1_g6x7opp,/r/DunderMifflin/comments/j115mn/what_is_yalls_favorite_episode/g6xbrtj/,1,DunderMifflin,comment,2020-09-28
10,AmateurZombie,1601269229,g6xbsw1,How's the candle business?,t1_g6wqby1,/r/DunderMifflin/comments/j11rjl/couples_where_only_one_is_an_essential_worker_be/g6xbsw1/,1,DunderMifflin,comment,2020-09-28
11,tommy_garry,1601269270,g6xbule,do people in the UK prefer UK version?,t3_j0oq3b,/r/DunderMifflin/comments/j0oq3b/pam_and_her_uk_counterpart/g6xbule/,1,DunderMifflin,comment,2020-09-28
12,[deleted],1601269299,g6xbvtv,[deleted],t1_g6wpnlt,/r/DunderMifflin/comments/j10z3s/calm_down_its_just_a_prank/g6xbvtv/,1,DunderMifflin,comment,2020-09-28
13,rexmacabre,1601269467,g6xc2v0,Can I also have a DM?,t1_g6vql6z,/r/DunderMifflin/comments/j0uwrt/the_office_extended_gone/g6xc2v0/,1,DunderMifflin,comment,2020-09-28
14,Im-Prison_Mike,1601269587,g6xc7vk,"And then you sneezed in my coffee and said dont worry it's just allergies, do you remember that?",t3_j15wzb,/r/DunderMifflin/comments/j15wzb/were_dying_here/g6xc7vk/,1,DunderMifflin,comment,2020-09-28
15,WillyBillyBlaze,1601269599,g6xc8da,Top and bottom panel are YouTube pranksters. Middle panel is from a scene in the office where one of the main characters makes a painful admission. He has has to admit to a group of high school seniors that he can no longer pay for their college despite promising that he would. This particular scene is regarded as one of the most painful scenes of the office to watch.,t1_g6x9vup,/r/DunderMifflin/comments/j10z3s/calm_down_its_just_a_prank/g6xc8da/,1,DunderMifflin,comment,2020-09-28
16,ASTROCOOKIE1066,1601269646,g6xcaek,It is very real and I think it's hilarious. I get that comedy is subjective but you can't claim it's fake when it very much isn't. Literally the only thing scripted is the intros to each challenge,t1_g6x383x,/r/DunderMifflin/comments/j10z3s/calm_down_its_just_a_prank/g6xcaek/,1,DunderMifflin,comment,2020-09-28
17,AutoModerator,1601269778,g6xcfuc,"Hey PsychoFett! Your submission has been automatically removed due to a minimum age requirement on your Reddit account. Your account must be at least 1 day old to post to the subreddit.

*I am a bot, and this action was performed automatically. Please [contact the moderators of this subreddit](/message/compose/?to=/r/DunderMifflin) if you have any questions or concerns.*",t3_j162cx,/r/DunderMifflin/comments/j162cx/ha_ha/g6xcfuc/,1,DunderMifflin,comment,2020-09-28
18,BlasterShow,1601269865,g6xcjjz,WHAT?,t1_g6wvran,/r/DunderMifflin/comments/j0wa7y/me_every_time_the_office_intro_starts/g6xcjjz/,1,DunderMifflin,comment,2020-09-28
19,GenghisKhan1206,1601269963,g6xcnne,Meanwhile q is making fun of joe who has a cannoli in his mouth.,t1_g6x8r3i,/r/DunderMifflin/comments/j10z3s/calm_down_its_just_a_prank/g6xcnne/,1,DunderMifflin,comment,2020-09-28
20,Kvothes_Last_Shirt,1601270016,g6xcpvg,"You’re correct, she didn’t know what it was going to be until after the documentary aired",t1_g6wyyiz,/r/DunderMifflin/comments/j0zman/just_make_a_bush/g6xcpvg/,1,DunderMifflin,comment,2020-09-28
21,Cali_Val,1601270064,g6xcrty,"I’m with you, for the exact same reason.

People really put this show on a pedestal... I just can’t get into it.. doesn’t appeal to me, the cringe humor is more cringe than humor, and the writing can be really cliche.

Not for me.",t1_g6x9mj4,/r/DunderMifflin/comments/j10z3s/calm_down_its_just_a_prank/g6xcrty/,1,DunderMifflin,comment,2020-09-28
22,AyyMVP,1601270139,g6xcuw3,Other people are allowed to have different reactions to things then you friend..,t1_g6x88gi,/r/DunderMifflin/comments/j10z3s/calm_down_its_just_a_prank/g6xcuw3/,1,DunderMifflin,comment,2020-09-28
23,No_Estimate1127,1601270203,g6xcxhr,They did when Steve Carrell hosted,t1_g6qcj0q,/r/DunderMifflin/comments/j09dsh/rainn_wilson_tries_to_escape_the_office_on_snl/g6xcxhr/,1,DunderMifflin,comment,2020-09-28
24,sambamamerican,1601270229,g6xcyku,"Yeah, it was by the guy who would get them from their trailers to the set. Disappointing to me as well.",t1_g6x6dau,/r/DunderMifflin/comments/i3lqr6/jenna_fischer_on_a_reboot_in_andy_greenes_office/g6xcyku/,1,DunderMifflin,comment,2020-09-28
25,No_Estimate1127,1601270263,g6xd00b,Hahaha same,t1_g6r6wey,/r/DunderMifflin/comments/j09dsh/rainn_wilson_tries_to_escape_the_office_on_snl/g6xd00b/,1,DunderMifflin,comment,2020-09-28
26,V1ncentAdultman,1601270264,g6xd01o,Nope. Just tried to watch it again. Could get past the part where he walks into the cheering classroom. WTH was he thinking??!!,t1_g6x88gi,/r/DunderMifflin/comments/j10z3s/calm_down_its_just_a_prank/g6xd01o/,1,DunderMifflin,comment,2020-09-28
27,LeDevnoob,1601270265,g6xd02v,"Wtf!?? no.. they’re from a show called Impractical Jokers. It’s on TruTV. They do pranks and other funny skits. The show is funny as fuck, like you’ll ribs will hurt from laughing so hard and it’s also super cringy to the point that you have to look away or change the channel. it’s a great show.

I’m sure you can find them on YouTube",t1_g6xc8da,/r/DunderMifflin/comments/j10z3s/calm_down_its_just_a_prank/g6xd02v/,1,DunderMifflin,comment,2020-09-28
28,No_Estimate1127,1601270303,g6xd1lb,I really thought he would host the first ep of the season but they announced Chris Rock,t1_g6qszrn,/r/DunderMifflin/comments/j09dsh/rainn_wilson_tries_to_escape_the_office_on_snl/g6xd1lb/,1,DunderMifflin,comment,2020-09-28
29,dharv-0709,1601270311,g6xd1yh,"After all, Jim taught Pam.",t3_j161ff,/r/DunderMifflin/comments/j161ff/absolutely_i_do/g6xd1yh/,1,DunderMifflin,comment,2020-09-28
30,No_Estimate1127,1601270359,g6xd3yc,That’s the day my little brother was born!,t1_g6qrrgg,/r/DunderMifflin/comments/j09dsh/rainn_wilson_tries_to_escape_the_office_on_snl/g6xd3yc/,1,DunderMifflin,comment,2020-09-28
31,AlmondBoyOfSJ,1601270387,g6xd563,"Also, it wasn’t the first time, either",t3_j166mn,/r/DunderMifflin/comments/j166mn/ive_heard_that_all_of_jims_pranks_were_justified/g6xd563/,1,DunderMifflin,comment,2020-09-28
32,mossman,1601270417,g6xd6e8,The Face is way too small and way too full of black colored in areas for it to match.  Definitely something else.,t1_g6x5rm3,/r/DunderMifflin/comments/j0wqd7/rainn_wilson_has_his_pervert_sketch_in_his_office/g6xd6e8/,1,DunderMifflin,comment,2020-09-28
33,No_Estimate1127,1601270445,g6xd7lq,"It’s a live show, that’s not a laugh track.",t1_g6s1qpo,/r/DunderMifflin/comments/j09dsh/rainn_wilson_tries_to_escape_the_office_on_snl/g6xd7lq/,1,DunderMifflin,comment,2020-09-28
34,WillyBillyBlaze,1601270450,g6xd7sz,"Sounds good, I’ll have to check them out!",t1_g6xd02v,/r/DunderMifflin/comments/j10z3s/calm_down_its_just_a_prank/g6xd7sz/,1,DunderMifflin,comment,2020-09-28
35,No_Estimate1127,1601270455,g6xd819,Feb 24 2007,t1_g6s7wvd,/r/DunderMifflin/comments/j09dsh/rainn_wilson_tries_to_escape_the_office_on_snl/g6xd819/,1,DunderMifflin,comment,2020-09-28
36,No_Estimate1127,1601270472,g6xd8rd,"It’s a live show, it’s not a laugh track.",t1_g6ssura,/r/DunderMifflin/comments/j09dsh/rainn_wilson_tries_to_escape_the_office_on_snl/g6xd8rd/,1,DunderMifflin,comment,2020-09-28
37,No_Estimate1127,1601270509,g6xdab5,They did it when Steve Carrell hosted I’m pretty sure,t1_g6raw0g,/r/DunderMifflin/comments/j09dsh/rainn_wilson_tries_to_escape_the_office_on_snl/g6xdab5/,1,DunderMifflin,comment,2020-09-28
38,No_Estimate1127,1601270531,g6xdb8y,"It’s a live audience, not a laugh track",t1_g6s2bbz,/r/DunderMifflin/comments/j09dsh/rainn_wilson_tries_to_escape_the_office_on_snl/g6xdb8y/,1,DunderMifflin,comment,2020-09-28
39,jackybeau,1601270553,g6xdc4q,"Yeah, Jim is just a dick",t3_j166mn,/r/DunderMifflin/comments/j166mn/ive_heard_that_all_of_jims_pranks_were_justified/g6xdc4q/,1,DunderMifflin,comment,2020-09-28
40,No_Estimate1127,1601270557,g6xdcag,"Live audience, not a laugh track",t1_g6szfb0,/r/DunderMifflin/comments/j09dsh/rainn_wilson_tries_to_escape_the_office_on_snl/g6xdcag/,1,DunderMifflin,comment,2020-09-28
41,No_Estimate1127,1601270581,g6xddbl,Season 32 episode 14,t1_g6s541f,/r/DunderMifflin/comments/j09dsh/rainn_wilson_tries_to_escape_the_office_on_snl/g6xddbl/,1,DunderMifflin,comment,2020-09-28
42,No_Estimate1127,1601270651,g6xdg9d,This was in 2007 lol,t1_g6ri5yj,/r/DunderMifflin/comments/j09dsh/rainn_wilson_tries_to_escape_the_office_on_snl/g6xdg9d/,1,DunderMifflin,comment,2020-09-28
43,WestDublinPleasanton,1601270660,g6xdglc,"""Behold... Jesus Christ.""

""Oh Michael it must be obvious you can't do this.""

""Aaaahh, the antichrist.""",t1_g6x25os,/r/DunderMifflin/comments/j12cy8/i_am_here_to_beer_you_straaaaaaight/g6xdglc/,1,DunderMifflin,comment,2020-09-28
44,aesthetic_cock,1601270693,g6xdhwg,Because people somehow think reddit is a small corner of the internet,t1_g6wzrnl,/r/DunderMifflin/comments/j10z3s/calm_down_its_just_a_prank/g6xdhwg/,1,DunderMifflin,comment,2020-09-28
45,[deleted],1601270784,g6xdlm5,[removed],t1_g6x53yb,/r/DunderMifflin/comments/j10z3s/calm_down_its_just_a_prank/g6xdlm5/,1,DunderMifflin,comment,2020-09-28
46,[deleted],1601270844,g6xdo3f,[removed],t1_g6xcnne,/r/DunderMifflin/comments/j10z3s/calm_down_its_just_a_prank/g6xdo3f/,1,DunderMifflin,comment,2020-09-28
47,big_boi_aang,1601271101,g6xdyli,Dwight's a man of culture of course,t3_j13n6u,/r/DunderMifflin/comments/j13n6u/how_the_turntables/g6xdyli/,1,DunderMifflin,comment,2020-09-28
48,Snuggles821,1601271482,g6xee3v,I will Nevah forgive you!!,t1_g6xai82,/r/DunderMifflin/comments/j10z3s/calm_down_its_just_a_prank/g6xee3v/,1,DunderMifflin,comment,2020-09-28
49,Fajitajitas,1601271646,g6xekjb,That’s a great catch,t3_j16e14,/r/DunderMifflin/comments/j16e14/just_noticed_in_this_scene_dwight_says_his_salary/g6xekjb/,1,DunderMifflin,comment,2020-09-28
50,Technically_Can_Hear,1601271734,g6xeo12,Blatantly untrue. I got to be in the audience during a punishment where they suspended one of them from a crane and beat him like a piñata and it was very real.,t1_g6x383x,/r/DunderMifflin/comments/j10z3s/calm_down_its_just_a_prank/g6xeo12/,1,DunderMifflin,comment,2020-09-28
51,[deleted],1601271899,g6xeuhp,[removed],t1_g6x2o39,/r/DunderMifflin/comments/j0zman/just_make_a_bush/g6xeuhp/,1,DunderMifflin,comment,2020-09-28
52,skyho,1601271919,g6xevas,r/CannotWatchScottsTots,t1_g6x0pli,/r/DunderMifflin/comments/j10z3s/calm_down_its_just_a_prank/g6xevas/,1,DunderMifflin,comment,2020-09-28
53,acortright,1601272234,g6xf7ql,"It’s free on Peacock, or will be, I think. Don’t quote me on that though.",t1_g6wmwso,/r/DunderMifflin/comments/j0wa7y/me_every_time_the_office_intro_starts/g6xf7ql/,1,DunderMifflin,comment,2020-09-28
54,ambergirl9860,1601272251,g6xf8e2,Live a silly little nerf ball life,t1_g6wrsw7,/r/DunderMifflin/comments/j0zman/just_make_a_bush/g6xf8e2/,1,DunderMifflin,comment,2020-09-28
55,frescodee,1601272322,g6xfb5d,*we’ll give you a win if you tell them you got them a lithium battery,t3_j10z3s,/r/DunderMifflin/comments/j10z3s/calm_down_its_just_a_prank/g6xfb5d/,1,DunderMifflin,comment,2020-09-28
56,EightBiscuit01,1601272562,g6xfkka,“Cheers. I’ll drink to that bro.”,t3_j168r7,/r/DunderMifflin/comments/j168r7/fuck_charles_miner_and_fuck_deangelo/g6xfkka/,1,DunderMifflin,comment,2020-09-28
57,stokersBSU96,1601272604,g6xfm4c,beat you to it. What you drinking?,t1_g6xfkka,/r/DunderMifflin/comments/j168r7/fuck_charles_miner_and_fuck_deangelo/g6xfm4c/,1,DunderMifflin,comment,2020-09-28
58,amusicc,1601272774,g6xfspv,Same,t3_j168r7,/r/DunderMifflin/comments/j168r7/fuck_charles_miner_and_fuck_deangelo/g6xfspv/,1,DunderMifflin,comment,2020-09-28
59,michael-g-scott-bot,1601272805,g6xftwn,I am ashamed at your naked face.,t1_g6xdglc,/r/DunderMifflin/comments/j12cy8/i_am_here_to_beer_you_straaaaaaight/g6xftwn/,1,DunderMifflin,comment,2020-09-28
60,Ozzytudor,1601272896,g6xfxfg,Never seen a homeless chinese fella.,t1_g6v5fzf,/r/DunderMifflin/comments/j0oq3b/pam_and_her_uk_counterpart/g6xfxfg/,1,DunderMifflin,comment,2020-09-28
61,treybgame,1601272973,g6xg0gk,I just gotta disagree on Charles bro. His character made me laugh hysterically with the amount of cringe and general discomfort towards the Scranton staff. I laughed so hard at those episodes. Deangelo was a waste of Will's time.,t3_j168r7,/r/DunderMifflin/comments/j168r7/fuck_charles_miner_and_fuck_deangelo/g6xg0gk/,1,DunderMifflin,comment,2020-09-28
62,kingsnake84,1601273121,g6xg646,A meme combining two of my favorite shows!,t3_j16dhr,/r/DunderMifflin/comments/j16dhr/too_lazy_to_remove_the_username_tag/g6xg646/,1,DunderMifflin,comment,2020-09-28
63,aub6,1601273149,g6xg76f,Is that creed or chuck Schumer?,t3_j135kt,/r/DunderMifflin/comments/j135kt/this_weekends_chalk_art_of_creed/g6xg76f/,1,DunderMifflin,comment,2020-09-28
64,daboss6595,1601273225,g6xga2q,Good luck,t3_j16r28,/r/DunderMifflin/comments/j16r28/had_a_few_drinks_wish_me_luck/g6xga2q/,1,DunderMifflin,comment,2020-09-28
65,stokersBSU96,1601273252,g6xgb45,"I don’t hate the fact that Charles Miner ever happened. It was because of him that Michael started the Michael Scott Paper Company, which was such a cool episode. But I absolutely hate when people undermine Michael. Michael does and says a lot of dump stuff, but he has an incredibly pure heart. Team Michael forever. But yeah... fuck Deangelo",t1_g6xg0gk,/r/DunderMifflin/comments/j168r7/fuck_charles_miner_and_fuck_deangelo/g6xgb45/,1,DunderMifflin,comment,2020-09-28
66,GameOfUsernames,1601273284,g6xgcb8,To me it’s just that no one would’ve let Michael go there. They’d have just called and told them on the phone.,t1_g6x4a5s,/r/DunderMifflin/comments/j10z3s/calm_down_its_just_a_prank/g6xgcb8/,1,DunderMifflin,comment,2020-09-28
67,justandhans,1601273481,g6xgjo6,Sup Pamster.,t3_j15wzb,/r/DunderMifflin/comments/j15wzb/were_dying_here/g6xgjo6/,1,DunderMifflin,comment,2020-09-28
68,BMacklin247,1601273885,g6xgyko,"And then you sneezed in my tea and said don't worry it's just allergies, do you remember that?",t3_j15wzb,/r/DunderMifflin/comments/j15wzb/were_dying_here/g6xgyko/,1,DunderMifflin,comment,2020-09-28
69,BMacklin247,1601273971,g6xh1q9,Why are you the way that you are?,t1_g6wer3j,/r/DunderMifflin/comments/j0sx76/michael_was_that_many_days_old_when_he_found_out/g6xh1q9/,1,DunderMifflin,comment,2020-09-28
70,NScars,1601273984,g6xh26l,This ^^^,t1_g6xgb45,/r/DunderMifflin/comments/j168r7/fuck_charles_miner_and_fuck_deangelo/g6xh26l/,1,DunderMifflin,comment,2020-09-28
71,topherware92,1601273986,g6xh29z,"Okay wait wait.....

...they're lithium.",t3_j0wait,/r/DunderMifflin/comments/j0wait/how_dare_you_mr_scott/g6xh29z/,1,DunderMifflin,comment,2020-09-28
72,rafwaf123,1601274062,g6xh544,Kristin Wig with a great Pam impersonation,t3_j10z3s,/r/DunderMifflin/comments/j10z3s/calm_down_its_just_a_prank/g6xh544/,1,DunderMifflin,comment,2020-09-28
73,BOBBYTURKAL1NO,1601274066,g6xh595,/r/CantWatchScottsTots would like a word,t3_j10z3s,/r/DunderMifflin/comments/j10z3s/calm_down_its_just_a_prank/g6xh595/,1,DunderMifflin,comment,2020-09-28
74,BMacklin247,1601274139,g6xh7wp,"Dwight, get out of my nook.",t1_g6tlqdp,/r/DunderMifflin/comments/j0nn0t/credits_the_office_addict_group_on_fb/g6xh7wp/,1,DunderMifflin,comment,2020-09-28
75,boltsyeah9,1601274196,g6xha03,Lmao I tweeted this quote just yesterday,t1_g6wmtse,/r/DunderMifflin/comments/j10z3s/calm_down_its_just_a_prank/g6xha03/,1,DunderMifflin,comment,2020-09-28
76,ZuniBBa,1601274218,g6xhasx,They’ve actually done that a couple times lmao,t1_g6wtl0v,/r/DunderMifflin/comments/j10z3s/calm_down_its_just_a_prank/g6xhasx/,1,DunderMifflin,comment,2020-09-28
77,boltsyeah9,1601274235,g6xhbf8,https://twitter.com/maburrn/status/1309936744700227585?s=21,t1_g6wmtse,/r/DunderMifflin/comments/j10z3s/calm_down_its_just_a_prank/g6xhbf8/,1,DunderMifflin,comment,2020-09-28
78,sec713,1601274339,g6xhfae,"""Now tell em about the batteries; really play up how they're the lithium kind!""",t3_j10z3s,/r/DunderMifflin/comments/j10z3s/calm_down_its_just_a_prank/g6xhfae/,1,DunderMifflin,comment,2020-09-28
79,Terradactyl87,1601274474,g6xhk57,False! It comes wrapped in a maxi pad,t1_g6wldow,/r/DunderMifflin/comments/j0xezy/mixed_my_office_deck_with_the_period_pack/g6xhk57/,1,DunderMifflin,comment,2020-09-28
80,nebula_2k,1601274578,g6xhnwb,This is the way!,t3_j11g6w,/r/DunderMifflin/comments/j11g6w/found_a_way_to_combine_my_two_obsessions_plants/g6xhnwb/,1,DunderMifflin,comment,2020-09-28
81,thatoneguywhofucks,1601274589,g6xhoad,People genuinely hate it even though it’s just a tv show?,t1_g6wvnmg,/r/DunderMifflin/comments/j10z3s/calm_down_its_just_a_prank/g6xhoad/,1,DunderMifflin,comment,2020-09-28
82,NewNerdOnTheBlock,1601274689,g6xhrzr,The geometric proportions of his face are perfect in every way but one. The nose is too small!,t3_j10v30,/r/DunderMifflin/comments/j10v30/did_a_little_sidewalk_chalk_in_my_neighborhood_a/g6xhrzr/,1,DunderMifflin,comment,2020-09-28
83,NewNerdOnTheBlock,1601274904,g6xhzvp,This is me studying for my exams!,t3_j0yw5g,/r/DunderMifflin/comments/j0yw5g/how_did_i_not_know_of_this_deleted_scene/g6xhzvp/,1,DunderMifflin,comment,2020-09-28
84,[deleted],1601274964,g6xi22v,[removed],t3_j10z3s,/r/DunderMifflin/comments/j10z3s/calm_down_its_just_a_prank/g6xi22v/,1,DunderMifflin,comment,2020-09-28
85,ThorusBonus,1601275270,g6xid1f,Whats this episode called?,t3_j10z3s,/r/DunderMifflin/comments/j10z3s/calm_down_its_just_a_prank/g6xid1f/,1,DunderMifflin,comment,2020-09-28
86,theTRUTH4444,1601275411,g6xii10,Yes.,t1_g6xbule,/r/DunderMifflin/comments/j0oq3b/pam_and_her_uk_counterpart/g6xii10/,1,DunderMifflin,comment,2020-09-28
87,Tor_go,1601275498,g6xil49,This is the cringiest episode I've ever seen in my life and that says something because I've never seen it. Always skipped it. I don't understand where the writers were trying to go with this episode.,t3_j10z3s,/r/DunderMifflin/comments/j10z3s/calm_down_its_just_a_prank/g6xil49/,1,DunderMifflin,comment,2020-09-28
88,KradeSmith,1601275593,g6xiola,"Mine would be 83,636.28",t3_j16e14,/r/DunderMifflin/comments/j16e14/just_noticed_in_this_scene_dwight_says_his_salary/g6xiola/,1,DunderMifflin,comment,2020-09-28
89,iDirtyDianaX,1601275617,g6xipfx,Joe is the best,t1_g6wtswl,/r/DunderMifflin/comments/j10z3s/calm_down_its_just_a_prank/g6xipfx/,1,DunderMifflin,comment,2020-09-28
90,iDirtyDianaX,1601275657,g6xiqvn,Which makes him a real gent tbh,t1_g6x33ek,/r/DunderMifflin/comments/j10z3s/calm_down_its_just_a_prank/g6xiqvn/,1,DunderMifflin,comment,2020-09-28
91,iDirtyDianaX,1601275682,g6xirss,I'd pay for this,t1_g6wu448,/r/DunderMifflin/comments/j10z3s/calm_down_its_just_a_prank/g6xirss/,1,DunderMifflin,comment,2020-09-28
92,iDirtyDianaX,1601275714,g6xisz9,Lol what a loser,t1_g6wycon,/r/DunderMifflin/comments/j10z3s/calm_down_its_just_a_prank/g6xisz9/,1,DunderMifflin,comment,2020-09-28
93,michael-g-scott-bot,1601276405,g6xjhgw,"Leave all your preconceived notions about casinos at the door. Old friends, new lovers, and the disabled! Welcome all!",t1_g6xgcb8,/r/DunderMifflin/comments/j10z3s/calm_down_its_just_a_prank/g6xjhgw/,1,DunderMifflin,comment,2020-09-28
94,Sanity_Not_Found,1601276539,g6xjm9g,I was watching this exact scene as I came across the meme!,t3_j10z3s,/r/DunderMifflin/comments/j10z3s/calm_down_its_just_a_prank/g6xjm9g/,1,DunderMifflin,comment,2020-09-28
95,royrogersmcfreely3,1601276608,g6xjojd,Floss is boss,t1_g6umw09,/r/DunderMifflin/comments/j0oq3b/pam_and_her_uk_counterpart/g6xjojd/,1,DunderMifflin,comment,2020-09-28
96,itsallworthy,1601276635,g6xjphk,Nobody was nobody's bitch,t3_j12cy8,/r/DunderMifflin/comments/j12cy8/i_am_here_to_beer_you_straaaaaaight/g6xjphk/,1,DunderMifflin,comment,2020-09-28
97,reginaldp00fta,1601276911,g6xjyu3,Ok?,t1_g6xiola,/r/DunderMifflin/comments/j16e14/just_noticed_in_this_scene_dwight_says_his_salary/g6xjyu3/,1,DunderMifflin,comment,2020-09-28
98,Pee-PAH,1601276930,g6xjzh0,Now go tell then that student loans carry 7% interest.,t3_j10z3s,/r/DunderMifflin/comments/j10z3s/calm_down_its_just_a_prank/g6xjzh0/,1,DunderMifflin,comment,2020-09-28
99,mahootenanny,1601277025,g6xk2rm,"It was on company property, with company property. So, double jeopardy, we're fine.",t3_j12zhi,/r/DunderMifflin/comments/j12zhi/when_michael_hit_meredith_with_his_car/g6xk2rm/,1,DunderMifflin,comment,2020-09-28
100,ddot1687,1600404553,g5o8yua,rashida jones ANYDAY,t3_iuw2ye,/r/DunderMifflin/comments/iuw2ye/dilemma/g5o8yua/,78,DunderMifflin,comment,2020-09-18
101,sarhan182,1600404561,g5o8z88,Ann Perkins anytime anyday,t3_iuw2ye,/r/DunderMifflin/comments/iuw2ye/dilemma/g5o8z88/,29,DunderMifflin,comment,2020-09-18
102,hmmmmmmmmmmmms,1600404564,g5o8zcb,He no like dumb,t1_g5nsxgx,/r/DunderMifflin/comments/iuq0ln/kevin_vs_jim_side_glances/g5o8zcb/,6,DunderMifflin,comment,2020-09-18
103,go_Raptors,1600404572,g5o8zqu,Whoever bought the props and designed that house is a genius.,t3_iusrlr,/r/DunderMifflin/comments/iusrlr/i_edited_the_dinner_party_bloopers_into_one/g5o8zqu/,4,DunderMifflin,comment,2020-09-18
104,stevenw84,1600404584,g5o90de,Karen all day. Especially from behind.,t3_iuw2ye,/r/DunderMifflin/comments/iuw2ye/dilemma/g5o90de/,18,DunderMifflin,comment,2020-09-18
105,only_the_office,1600404593,g5o90si,*whispers: it’s a million dollar bet...*,t1_g5mz5jp,/r/DunderMifflin/comments/iut2ya/in_safety_training_as_jim_and_pam_realize_that/g5o90si/,2,DunderMifflin,comment,2020-09-18
106,meownda1492,1600404614,g5o91uq,No clue who the others are..,t3_iuzgui,/r/DunderMifflin/comments/iuzgui/which_is_the_bestyour_favorite_couple_of_these/g5o91uq/,2,DunderMifflin,comment,2020-09-18
107,only_the_office,1600404627,g5o92hm,"Sorry, I’ve got penises on the brain!",t1_g5o8x6t,/r/DunderMifflin/comments/iutp0i/that_erin_easter_egg_isnt_correct_at_all_heres/g5o92hm/,24,DunderMifflin,comment,2020-09-18
108,cloudnyne,1600404642,g5o937q,SNIP SNAP SNIP SNAP,t3_iusrlr,/r/DunderMifflin/comments/iusrlr/i_edited_the_dinner_party_bloopers_into_one/g5o937q/,6,DunderMifflin,comment,2020-09-18
109,sarhan182,1600404649,g5o93jy,Don’t Jim the camera!,t3_iuq0ln,/r/DunderMifflin/comments/iuq0ln/kevin_vs_jim_side_glances/g5o93jy/,1,DunderMifflin,comment,2020-09-18
110,onamonapizza,1600404652,g5o93pt,Her dad must have been a GI.,t1_g5nswnu,/r/DunderMifflin/comments/iuw2ye/dilemma/g5o93pt/,17,DunderMifflin,comment,2020-09-18
111,LegoSkywalker,1600404720,g5o96zn,It’s because she will testify against the Scranton Strangler,t1_g5o1zcb,/r/DunderMifflin/comments/iuw2ye/dilemma/g5o96zn/,27,DunderMifflin,comment,2020-09-18
112,billyswaggins,1600404726,g5o97a2,"everyone is too lazy to double check, except one guy",t1_g5nyt2f,/r/DunderMifflin/comments/iutp0i/that_erin_easter_egg_isnt_correct_at_all_heres/g5o97a2/,14,DunderMifflin,comment,2020-09-18
113,tiswatitis,1600404746,g5o9893,Seconded,t1_g5n8cxy,/r/DunderMifflin/comments/iusrlr/i_edited_the_dinner_party_bloopers_into_one/g5o9893/,3,DunderMifflin,comment,2020-09-18
114,jason_kandel,1600404749,g5o98dl,i started brooklyn nine nine about a day ago and im already on season 3.,t1_g5o8tl4,/r/DunderMifflin/comments/iuzgui/which_is_the_bestyour_favorite_couple_of_these/g5o98dl/,0,DunderMifflin,comment,2020-09-18
115,ImRetrospective,1600404753,g5o98lt,"No preference, what do you think redhead or brunette?",t3_iuw2ye,/r/DunderMifflin/comments/iuw2ye/dilemma/g5o98lt/,0,DunderMifflin,comment,2020-09-18
116,FlyEaglesFly1996,1600404772,g5o99iu,2-9,t3_iuxpzd,/r/DunderMifflin/comments/iuxpzd/what_seasons_did_you_think_the_office_was_in_its/g5o99iu/,1,DunderMifflin,comment,2020-09-18
