,author,created_utc,id,body,parent_id,permalink,score,subreddit,ptype,time
1059,destroyergod-obelisk,1592631161,fvexwrb,Yeah the couple posted it,t3_hcfuz4,/r/DunderMifflin/comments/hcfuz4/dont_remember_if_this_has_already_been_here_but/fvexwrb/,1,DunderMifflin,comment,2020-06-20
1060,DaHuff,1592631203,fvexymj,"I feel like if he would have seen it he would turn into a legit stalker or something, what was the theory he was the Scranton strangler again? Jkjk",t3_hcfck8,/r/DunderMifflin/comments/hcfck8/goodbye_toby/fvexymj/,1,DunderMifflin,comment,2020-06-20
1061,Plus-Minute,1592631225,fvexzli,"I agree but it always bothers me that Pam and Ryan are in the negotiations. It’s even more annoying that Ryan thinks he has a right to any of the money, let alone the entire amount. I guess he really is a big time douche.",t3_hcgdz2,/r/DunderMifflin/comments/hcgdz2/michael_and_the_buyout/fvexzli/,1,DunderMifflin,comment,2020-06-20
1062,AlterPhoenix729,1592631451,fvey9ol,"Dwight: Who is he saying?
Michael: You’re right, I didn’t even think of him.
Dwight: No, Michael.
Michael: Yeah, that’s actually a really good idea.
Dwight: No, not me.
Michael: Yeah… I could.
Dwight: Not Dwight.
Michael: I’m not saying that’s what he said.
Dwight: I know that’s what he said.
Michael: [listening to his head] What?
Dwight: Tell him, not Dwight.
Michael: That is not a very nice thing to say about him.
Dwight: Tell him to stop.
Michael: Are you kidding?
Dwight: Quiet, you.
Michael: I agree. He’d land on his feet.
Dwight: Make him be quiet.",t3_hcdor8,/r/DunderMifflin/comments/hcdor8/cmon_jim/fvey9ol/,1,DunderMifflin,comment,2020-06-20
1063,ih8comingupwithnames,1592631474,fveyam3,"Plop is a charisma black hole. He sucks all the charisma and joy out of any scene he was in. I end up yelling at the tv until he stops talking just so I don't have to hear his voice. Esp if  cant find the remote to fast forward. 

He is the opposite of Batman.",t1_fvemy37,/r/DunderMifflin/comments/hc9ht2/erin_and_pete_were_the_best_couple/fveyam3/,1,DunderMifflin,comment,2020-06-20
1064,Flossgod,1592631528,fveyd03,The point of the “no one:” format is to show that whatever’s being featured was unasked for. I personally don’t think the meme would be funny if it just started with “the news:”,t1_fverag9,/r/DunderMifflin/comments/hc8tbk/just_get_in_the_coffin/fveyd03/,1,DunderMifflin,comment,2020-06-20
1065,reddit_133511,1592631603,fveygdo,Which movie/ show?,t3_hcggpl,/r/DunderMifflin/comments/hcggpl/was_not_expecting_to_hear_the_office_theme_song/fveygdo/,1,DunderMifflin,comment,2020-06-20
1066,ainvayiKAaccount,1592631695,fveykhh,"If someone says they can't see the resemblance between nick Offerman and Dwight schrute, don't trust them.",t3_hcf7tl,/r/DunderMifflin/comments/hcf7tl/young_nick_offerman_is_sending_off_some_real/fveykhh/,1,DunderMifflin,comment,2020-06-20
1067,CecilBCrazy,1592631702,fveykti,You made everything alriiiiiiiight,t1_fvexw64,/r/DunderMifflin/comments/hcgemm/the_last_of_us_had_a_little_gem_of_an_easter_egg/fveykti/,1,DunderMifflin,comment,2020-06-20
1068,WaldoTheGreat,1592631707,fveyl1t,I'm just disappointed she changed her mind about first dancing to her favorite song...,t3_hc4is3,/r/DunderMifflin/comments/hc4is3/hypocrite/fveyl1t/,1,DunderMifflin,comment,2020-06-20
1069,edibleflipflops,1592631810,fveyplt,Het am said the same thing only on a boat without her parents,t3_hc4is3,/r/DunderMifflin/comments/hc4is3/hypocrite/fveyplt/,1,DunderMifflin,comment,2020-06-20
1070,Rico_Rebelde,1592631843,fveyr2u,They always talk about Kevin perv moments and Angela was talking about donkey jizz on one of the episodes so they definitely 'go there' somemtimes,t1_fvdwpnc,/r/DunderMifflin/comments/hc0wdt/creed_is_legit_the_smartest_office_character/fveyr2u/,1,DunderMifflin,comment,2020-06-20
1071,ainvayiKAaccount,1592631870,fveys8a,"Andy doesn't get enough credit for maintaining a good relationship with angela after this. Obviously he pulled it out on Dwight, but since she was the main culprit - he did a really mature thing. If I was in his place, I would have left!",t3_hc4is3,/r/DunderMifflin/comments/hc4is3/hypocrite/fveys8a/,1,DunderMifflin,comment,2020-06-20
1072,Guren-Yagi,1592631888,fveyt1t,The King of Staten Island,t1_fveygdo,/r/DunderMifflin/comments/hcggpl/was_not_expecting_to_hear_the_office_theme_song/fveyt1t/,1,DunderMifflin,comment,2020-06-20
1073,Elstad123,1592631908,fveytvg,Kinda gives me Andy Dwyer videos,t3_hcf7tl,/r/DunderMifflin/comments/hcf7tl/young_nick_offerman_is_sending_off_some_real/fveytvg/,1,DunderMifflin,comment,2020-06-20
1074,ainvayiKAaccount,1592631935,fveyv3a,Spot on!,t3_hceacq,/r/DunderMifflin/comments/hceacq/classic_tuna_impressions/fveyv3a/,1,DunderMifflin,comment,2020-06-20
1075,kantowrestler,1592631937,fveyv5o,Creed was certainly interesting.,t3_hc0wdt,/r/DunderMifflin/comments/hc0wdt/creed_is_legit_the_smartest_office_character/fveyv5o/,1,DunderMifflin,comment,2020-06-20
1076,onamonapizza,1592632017,fveyylu,"Very funny, sir",t1_fvdwxk2,/r/DunderMifflin/comments/hc7q9e/i_borrowed_his_office_to_fart_in/fveyylu/,1,DunderMifflin,comment,2020-06-20
1077,_tony_pepperoni_,1592632024,fveyyx0,"“Cool hat Ryan, where’d you get it?”

“...I’d rather not say. Bitch.”",t3_hc86a7,/r/DunderMifflin/comments/hc86a7/science_bitch/fveyyx0/,1,DunderMifflin,comment,2020-06-20
1078,ainvayiKAaccount,1592632351,fvezcyz,"Oof, I wish this whole episode was deleted!",t3_hcakic,/r/DunderMifflin/comments/hcakic/im_in_danger/fvezcyz/,1,DunderMifflin,comment,2020-06-20
1079,RazgrizSquadron,1592632361,fvezdg2,If there was ever a crossover episode between P&amp;R and The Office I would have wanted it to be a situation where Ron and Dwight have to team up on some kind of DIY project or something. Feel like they'd make a great odd couple and could also bond over they're shared interests in handiwork and such.,t3_hcf7tl,/r/DunderMifflin/comments/hcf7tl/young_nick_offerman_is_sending_off_some_real/fvezdg2/,1,DunderMifflin,comment,2020-06-20
1080,AutoModerator,1592632399,fvezf1p,"Posts about merchandise, gifts, etc. are no longer allowed on /r/DunderMifflin, so your post has been removed. This applies to any sort of merchandise, whether homemade or not, for whatever occasion you got it. If **you** made something, yourself, please send us a modmail so we can investigate and reapprove your post if necessary. This rule is in place to get rid of spammers who create fake versions of anything posted to this subreddit. Thank you for your understanding.

*I am a bot, and this action was performed automatically. Please [contact the moderators of this subreddit](/message/compose/?to=/r/DunderMifflin) if you have any questions or concerns.*",t3_hcgrk9,/r/DunderMifflin/comments/hcgrk9/i_know_michael_bought_it_himself_but_the_mug_does/fvezf1p/,1,DunderMifflin,comment,2020-06-20
1081,Utinnni,1592632444,fvezh0p,DELETE ALL PICTURES OF NICK,t3_hcf7tl,/r/DunderMifflin/comments/hcf7tl/young_nick_offerman_is_sending_off_some_real/fvezh0p/,1,DunderMifflin,comment,2020-06-20
1082,physicsnerd109,1592632470,fvezi6a,"""Gumby has a better body than you. Boom, roasted""",t1_fvexm8h,/r/DunderMifflin/comments/hcfmcz/the_day_the_office_truly_downsized/fvezi6a/,1,DunderMifflin,comment,2020-06-20
1083,jonnypepperston,1592632473,fvezi9u,Who's that?,t3_hcdor8,/r/DunderMifflin/comments/hcdor8/cmon_jim/fvezi9u/,1,DunderMifflin,comment,2020-06-20
1084,kopitar-11,1592632550,fvezlkz,"“I hate babies who cry”

So all of them?",t3_hcfhj4,/r/DunderMifflin/comments/hcfhj4/i_hate_cece_and_heres_why/fvezlkz/,1,DunderMifflin,comment,2020-06-20
1085,Genocide_Fan,1592632558,fvezlvl,"""Mop the ice""",t3_hcf56k,/r/DunderMifflin/comments/hcf56k/litteraly_the_only_time_that_creed_has_been/fvezlvl/,1,DunderMifflin,comment,2020-06-20
1086,Doritoman6,1592632606,fveznxf,yup,t1_fvexo44,/r/DunderMifflin/comments/hcge9g/has_anyone_ever_told_you/fveznxf/,1,DunderMifflin,comment,2020-06-20
1087,tapasandswissmiss,1592632740,fveztn3,Oh god the picture too. I want to be best friends with this person.,t3_hc7get,/r/DunderMifflin/comments/hc7get/spotted_this_bad_boy_the_other_day_in_a_parking/fveztn3/,1,DunderMifflin,comment,2020-06-20
1088,Swine_Overlord,1592632762,fvezujm,Source?,t1_fveq0hb,/r/DunderMifflin/comments/hceskv/robert_californias_voicemail_to_nellie/fvezujm/,1,DunderMifflin,comment,2020-06-20
1089,michael-g-scott-bot,1592632805,fvezwf2,I bumped my elbow against the wall and now my elbow has a protruberance.,t1_fvey9ol,/r/DunderMifflin/comments/hcdor8/cmon_jim/fvezwf2/,1,DunderMifflin,comment,2020-06-20
1090,Jguy8969,1592632920,fvf01d7,"Dang, you really about to make me cry",t3_hcfmcz,/r/DunderMifflin/comments/hcfmcz/the_day_the_office_truly_downsized/fvf01d7/,1,DunderMifflin,comment,2020-06-20
1091,Homie_Waffle,1592632998,fvf04m6,"SO raw, so right, alll night, alrightt",t1_fveykti,/r/DunderMifflin/comments/hcgemm/the_last_of_us_had_a_little_gem_of_an_easter_egg/fvf04m6/,1,DunderMifflin,comment,2020-06-20
1092,Nothing_2_sneeze_at,1592633008,fvf050e,"I think Pam deserved to be there because she believed in Michael and left behind a secure job.

I agree about Ryan though, he's a selfish ass but he gets what he deserves (being demoted to temp).",t1_fvexzli,/r/DunderMifflin/comments/hcgdz2/michael_and_the_buyout/fvf050e/,1,DunderMifflin,comment,2020-06-20
1093,swepettax,1592633052,fvf06v0,"- Angela Bernard
- WILL NEVER BE HER NAME",t3_hc4is3,/r/DunderMifflin/comments/hc4is3/hypocrite/fvf06v0/,1,DunderMifflin,comment,2020-06-20
1094,ThatsMyNicketyName,1592633108,fvf0991,That idiot has been feeding us for a week!,t3_hcgi5s,/r/DunderMifflin/comments/hcgi5s/are_you_ready_for_some_meatball/fvf0991/,1,DunderMifflin,comment,2020-06-20
1095,captainhindsite5752,1592633133,fvf0aae,Jim - 🥴,t1_fvezwf2,/r/DunderMifflin/comments/hcdor8/cmon_jim/fvf0aae/,1,DunderMifflin,comment,2020-06-20
1096,mcr2d2,1592633277,fvf0gal,"You can just see the pride on his wife’s face, despite the pixels.",t3_hcfmcz,/r/DunderMifflin/comments/hcfmcz/the_day_the_office_truly_downsized/fvf0gal/,1,DunderMifflin,comment,2020-06-20
1097,gme186,1592633375,fvf0ke4,A shit lord,t3_hcdor8,/r/DunderMifflin/comments/hcdor8/cmon_jim/fvf0ke4/,1,DunderMifflin,comment,2020-06-20
1098,5ilverMaples,1592633391,fvf0l17,Whrrrrrrrroop,t3_hc38ol,/r/DunderMifflin/comments/hc38ol/i_saw_a_suck_it_in_the_wild/fvf0l17/,1,DunderMifflin,comment,2020-06-20
1099,baddiewinkle,1592633414,fvf0lyl,How do you like your eggs in the morning?,t1_fvdg1uu,/r/DunderMifflin/comments/hc7get/spotted_this_bad_boy_the_other_day_in_a_parking/fvf0lyl/,1,DunderMifflin,comment,2020-06-20
1100,SalNaturale,1591764657,ftjzgeu,He looks mentally challenged,t3_h03otx,/r/DunderMifflin/comments/h03otx/phillip_phillip_phillip/ftjzgeu/,1,DunderMifflin,comment,2020-06-10
1101,Renaud_Perron,1591764660,ftjzgk2,"Every year, I bring some of my Kevin, famous chili (I’m not sure if that’s how he says it sorry)",t3_gzwghz,/r/DunderMifflin/comments/gzwghz/poor_kev/ftjzgk2/,1,DunderMifflin,comment,2020-06-10
1102,AvatarofBro,1591764697,ftjzid5,Are we sure it's not Dwight asking for a new plague?,t3_gzwghz,/r/DunderMifflin/comments/gzwghz/poor_kev/ftjzid5/,1,DunderMifflin,comment,2020-06-10
1103,MildlyOkayLooking,1591764700,ftjziki,Came here to see this,t1_ftjfaka,/r/DunderMifflin/comments/gzwghz/poor_kev/ftjziki/,3,DunderMifflin,comment,2020-06-10
1104,eyanpearson,1591764748,ftjzkvc,This is my new favorite thing,t3_gzzoa8,/r/DunderMifflin/comments/gzzoa8/update_i_made_a_remix_of_the_office_theme_song/ftjzkvc/,2,DunderMifflin,comment,2020-06-10
1105,PersianExcurzion,1591764793,ftjzmz3,What if we’re not even to the part where the chili spills?,t3_gzwghz,/r/DunderMifflin/comments/gzwghz/poor_kev/ftjzmz3/,1,DunderMifflin,comment,2020-06-10
1106,Pizza_Appreciator,1591764795,ftjzn2o,"**Lloyd**: What happened, Roy? Some little philly break your heart?

**Roy**: No. It was a girl.

**Angela**: Looks like someone took the slow train from Philly.",t3_gzro1s,/r/DunderMifflin/comments/gzro1s/breath_spray_has_gotten_mintier_lately/ftjzn2o/,2,DunderMifflin,comment,2020-06-10
1107,Gamatee,1591764844,ftjzphy,I just finished my 5th runthrough the other night because of this,t3_h01k3q,/r/DunderMifflin/comments/h01k3q/i_know_youre_with_me/ftjzphy/,1,DunderMifflin,comment,2020-06-10
1108,PotentiallyMike,1591764892,ftjzruz,Does that mean 2021 is the spilled pit? Because honestly idk if we can take that much more lol,t3_gzwghz,/r/DunderMifflin/comments/gzwghz/poor_kev/ftjzruz/,1,DunderMifflin,comment,2020-06-10
1109,RememberTheMaine1996,1591764896,ftjzs1o,Well we gotta binge watch it before it leaves Netflix,t3_h01k3q,/r/DunderMifflin/comments/h01k3q/i_know_youre_with_me/ftjzs1o/,1,DunderMifflin,comment,2020-06-10
1110,abejaved,1591764965,ftjzvc9,"And here we are, trying to pick up the pieces and say it’s okay.",t3_gzwghz,/r/DunderMifflin/comments/gzwghz/poor_kev/ftjzvc9/,1,DunderMifflin,comment,2020-06-10
1111,prezuiwf,1591765019,ftjzxzn,I bought an Office-themed calendar late last year and January did not feature Jan and I was extremely upset,t1_ftivcre,/r/DunderMifflin/comments/gzwghz/poor_kev/ftjzxzn/,8,DunderMifflin,comment,2020-06-10
1112,RememberTheMaine1996,1591765019,ftjzxzq,There should've been a short vid of them throwing things in the quarry,t3_h01552,/r/DunderMifflin/comments/h01552/when_someone_you_never_talk_to_tries_to_make/ftjzxzq/,1,DunderMifflin,comment,2020-06-10
1113,Papantro,1591765044,ftjzz60,A little unrelated but I love how Michael hangs up on people just cutting them off,t1_ftjmso7,/r/DunderMifflin/comments/h00954/no_matter_how_many_times_i_see_it_makes_me_laugh/ftjzz60/,94,DunderMifflin,comment,2020-06-10
1114,michael-g-scott-bot,1591765205,ftk06zy,There are certain defining moments in a person's life. The day he is born. The day he grows hair. The day he starts a business. And the day he sells that business back to Dunder Mifflin. What have I learned from all of this? It is far too early to tell. I just know that I am flying high and I don't even want to think about it. I just want to enjoy it.,t1_ftjzz60,/r/DunderMifflin/comments/h00954/no_matter_how_many_times_i_see_it_makes_me_laugh/ftk06zy/,81,DunderMifflin,comment,2020-06-10
1115,iw183838,1591765283,ftk0aqf,"I feel like the show just wasn’t the office for season 8, they just didn’t know what to do when Michael left. Season 9 feels more normal, and overall is much better.",t1_ftjy99q,/r/DunderMifflin/comments/gzrb3d/i_laughed_every_time/ftk0aqf/,3,DunderMifflin,comment,2020-06-10
1116,homestuckperformer,1591765300,ftk0bje,"If there are handles to the pot, and he's wearing mittens because it's too hot to hold with his bare hands, why is he pressing it up against his body?",t3_gzwghz,/r/DunderMifflin/comments/gzwghz/poor_kev/ftk0bje/,1,DunderMifflin,comment,2020-06-10
1117,_shaftpunk,1591765330,ftk0d0w,You sigh like Jan.,t3_h00954,/r/DunderMifflin/comments/h00954/no_matter_how_many_times_i_see_it_makes_me_laugh/ftk0d0w/,34,DunderMifflin,comment,2020-06-10
1118,USSImplication,1591765377,ftk0fax,Got me feeling so hot hot hot,t1_ftjg4od,/r/DunderMifflin/comments/gzwghz/poor_kev/ftk0fax/,9,DunderMifflin,comment,2020-06-10
1119,Godzi11anano,1591765416,ftk0h6v,"They got laptop batteries, duh",t1_ftjp8b2,/r/DunderMifflin/comments/gzsvva/maybe_someday/ftk0h6v/,1,DunderMifflin,comment,2020-06-10
1120,Goldenart121,1591765445,ftk0ihp,K,t3_h046w4,/r/DunderMifflin/comments/h046w4/new_office_ladies_just_dropped/ftk0ihp/,1,DunderMifflin,comment,2020-06-10
1121,CodenameCardinal,1591765557,ftk0nzt,"Thank you!!! Hah, excellent excuse for me to go back at watch.",t1_ftdl36s,/r/DunderMifflin/comments/gyxsw9/which_michael_scott_are_you_the_sequel/ftk0nzt/,1,DunderMifflin,comment,2020-06-10
1122,mexicanfluff22,1591765617,ftk0qxc,He chonk,t3_h03h6m,/r/DunderMifflin/comments/h03h6m/additional_footage_of_angela_at_the_dinner_party/ftk0qxc/,1,DunderMifflin,comment,2020-06-10
1123,cheeses_greist,1591765623,ftk0r8n,"Welcome, salty non-fans! Holy shit.",t3_gzvps2,/r/DunderMifflin/comments/gzvps2/this_is_true/ftk0r8n/,1,DunderMifflin,comment,2020-06-10
1124,johnnyonio,1591765678,ftk0tx8,what can you do with an award?   can i give it to someone else?,t1_ftjndpw,/r/DunderMifflin/comments/h025r7/how_do_you_spell_pams_name/ftk0tx8/,1,DunderMifflin,comment,2020-06-10
1125,matfalko,1591765686,ftk0u9b,"I'm very jealous of this show, I don't particularly like it got so popular tbf.",t3_gzsvva,/r/DunderMifflin/comments/gzsvva/maybe_someday/ftk0u9b/,1,DunderMifflin,comment,2020-06-10
1126,johnnyonio,1591765693,ftk0ukv,ok tuna,t1_ftjngqx,/r/DunderMifflin/comments/h025r7/how_do_you_spell_pams_name/ftk0ukv/,1,DunderMifflin,comment,2020-06-10
1127,HotWilbury,1591765752,ftk0xeh,"I'd say any scene with DeAngelo Vickers, or the one with Michael's nephew gettin' spanked. But hey, Kevin's famous chilli scene is as disastrous as the current year.",t3_gzwghz,/r/DunderMifflin/comments/gzwghz/poor_kev/ftk0xeh/,1,DunderMifflin,comment,2020-06-10
1128,TiltMastery,1591765798,ftk0zj5,Vpn,t1_ftjxggi,/r/DunderMifflin/comments/h03m1n/neflix_account_is_gonna_go_bye_bye/ftk0zj5/,2,DunderMifflin,comment,2020-06-10
1129,hhhnou,1591765867,ftk12uk,Why do I feel like John had the exact same voice since he was like 18-19,t3_gznf66,/r/DunderMifflin/comments/gznf66/oh_young_jim_theres_just_so_much_i_need_to_warn/ftk12uk/,1,DunderMifflin,comment,2020-06-10
1130,CT-6798,1591765895,ftk146d,I always hated how they turned Andy into a complete asshole towards the end. His first couple episodes as manager really made me love him especially when he got his nard dog tattoo.,t3_gzqqyb,/r/DunderMifflin/comments/gzqqyb/i_made_a_graph_showing_andys_likeability_over_time/ftk146d/,3,DunderMifflin,comment,2020-06-10
1131,armyfidds,1591765922,ftk15in,The cameramen are creepy psychopaths,t3_gzy9w3,/r/DunderMifflin/comments/gzy9w3/lets_just_see_where_this_goes/ftk15in/,2,DunderMifflin,comment,2020-06-10
1132,chinnu34,1591765982,ftk18cu,"To each his own. I didn't like space force at all, it was bland and almost pointless but love office and parks and rec.",t1_ftjtvss,/r/DunderMifflin/comments/gzsvva/maybe_someday/ftk18cu/,6,DunderMifflin,comment,2020-06-10
1133,dzgh,1591766008,ftk19kw,The intuition part is so good,t1_ftj0aq7,/r/DunderMifflin/comments/gzwghz/poor_kev/ftk19kw/,1,DunderMifflin,comment,2020-06-10
1134,Mowglli,1591766091,ftk1dm4,i hate u,t1_ftk18cu,/r/DunderMifflin/comments/gzsvva/maybe_someday/ftk1dm4/,2,DunderMifflin,comment,2020-06-10
1135,chinnu34,1591766146,ftk1g9e,Cool beans. Let's meet at the quarry and throw some rocks down.,t1_ftk1dm4,/r/DunderMifflin/comments/gzsvva/maybe_someday/ftk1g9e/,9,DunderMifflin,comment,2020-06-10
1136,HalpertsLeftNut,1591766185,ftk1i8b,You are a superfluous character in your own life?,t3_h042wm,/r/DunderMifflin/comments/h042wm/this_scene_is_the_best/ftk1i8b/,1,DunderMifflin,comment,2020-06-10
1137,general_cat_master,1591766259,ftk1lra,they’ll suck the covid right out of you!,t1_ftjuerd,/r/DunderMifflin/comments/h02979/you_guys_think_prisons_so_great/ftk1lra/,1,DunderMifflin,comment,2020-06-10
1138,Gunnersauras3,1591766262,ftk1lw7,I think he had one when he was interim manager in season 7,t3_gzmp5n,/r/DunderMifflin/comments/gzmp5n/where_was_dwights_manager_clip_in_the_intro/ftk1lw7/,1,DunderMifflin,comment,2020-06-10
1139,shendrad,1591766272,ftk1mdn,Bout dang time,t3_h046w4,/r/DunderMifflin/comments/h046w4/new_office_ladies_just_dropped/ftk1mdn/,3,DunderMifflin,comment,2020-06-10
1140,IAmGoobi,1591766272,ftk1mei,Nifty!!,t1_ftcgzth,/r/DunderMifflin/comments/gxdy6z/welcome_to_our_new_mods/ftk1mei/,1,DunderMifflin,comment,2020-06-10
1141,teh_pwn_ranger,1591766385,ftk1rso,"It did work, though. Dunder Mifflin bought the company and if you factor in the cost of salaries/benefits for Michael, Pam, and Ryan they paid hundreds of thousands of dollars for it. Have you ever started a company from scratch and sold it for hundreds of thousands of dollars within a month of founding it? I'd call it a success.",t3_h02seh,/r/DunderMifflin/comments/h02seh/the_michael_scott_paper_company_should_have_worked/ftk1rso/,1,DunderMifflin,comment,2020-06-10
1142,RarelyReadReplies,1591766624,ftk2355,"Yeah, every time he was on screen, it was gold. I really wish he was on more episodes and had more lines.",t1_ftjxo4r,/r/DunderMifflin/comments/gzsvva/maybe_someday/ftk2355/,3,DunderMifflin,comment,2020-06-10
1143,mikechr2k7,1591766663,ftk251e,Sass,t3_h046w4,/r/DunderMifflin/comments/h046w4/new_office_ladies_just_dropped/ftk251e/,2,DunderMifflin,comment,2020-06-10
1144,Gunnersauras3,1591766818,ftk2caj,Lol why would they join him? His company was going down. He bluffed Wallace into buying his company. Now I hated Charles Miner and the way DM treated Micheal but saying others should follow him for that is stupid. Also if you remember Ryan lost Dwight's 10 years of client and it is shown that both Pam and Ryan are bad salesman. So obviously original sales people would want their clients back cause they know Ryan and Pam would lose them.,t3_gzffzj,/r/DunderMifflin/comments/gzffzj/michael_did_nothing_wrong/ftk2caj/,1,DunderMifflin,comment,2020-06-10
1145,LuisTheLycan,1591766892,ftk2fqx,This is...ominous,t1_ftj6rz2,/r/DunderMifflin/comments/gzwghz/poor_kev/ftk2fqx/,1,DunderMifflin,comment,2020-06-10
1146,dizzler0613,1591767119,ftk2qfy,"No way, “The Fire” cold open is 2020...it starts with a fire, has a bunch of people freaking out and ends with a black guy on his back",t1_ftiosq6,/r/DunderMifflin/comments/gzwghz/poor_kev/ftk2qfy/,22,DunderMifflin,comment,2020-06-10
1147,AutoModerator,1591767142,ftk2rjk,"Hey Mandeazy2Easy! Your submission has been automatically removed because your post may be breaking rule 4. Politically related posts are forbidden in this subreddit. If this post does not contain ANY political figure **and** could not be construed in a political fashion, please message the mods with a link to your post. Thanks!

*I am a bot, and this action was performed automatically. Please [contact the moderators of this subreddit](/message/compose/?to=/r/DunderMifflin) if you have any questions or concerns.*",t3_h04kow,/r/DunderMifflin/comments/h04kow/black_lives_matter/ftk2rjk/,1,DunderMifflin,comment,2020-06-10
1148,PotentialChoice,1591767150,ftk2rxa,The whole story that Michael tells at the end about the woman who comes to the bar but doesn’t have ID—that’s also Angela. He just doesn’t realize it.,t3_h02ag0,/r/DunderMifflin/comments/h02ag0/ive_watched_the_office_so_many_times_but_i_never/ftk2rxa/,1,DunderMifflin,comment,2020-06-10
1149,uniqueusernamehello,1591767150,ftk2rxd,"looooool I'm not an American, hence the mistake",t1_ftjd2ot,/r/DunderMifflin/comments/gzy730/noticed_for_the_first_time_oscar_not_repeating/ftk2rxd/,1,DunderMifflin,comment,2020-06-10
1150,PotentialChoice,1591767185,ftk2tkd,Don’t not not bother Luke,t3_gzyu6k,/r/DunderMifflin/comments/gzyu6k/can_someone_translate_this_hieroglyph_of_a_symbol/ftk2tkd/,1,DunderMifflin,comment,2020-06-10
1151,realamanhasnoname,1591767201,ftk2uaw,WHATS GOING ON!!!!,t3_gzxm3t,/r/DunderMifflin/comments/gzxm3t/my_favorite_toby_song/ftk2uaw/,7,DunderMifflin,comment,2020-06-10
1152,TexehCtpaxa,1591767227,ftk2vhw,"They tried, but Plop* was never as likeable as Jim for me, and I don't really like Jim that much.",t3_h04k4l,/r/DunderMifflin/comments/h04k4l/plomp_really_is_the_new_jim/ftk2vhw/,1,DunderMifflin,comment,2020-06-10
1153,pradeeps85,1591767235,ftk2vvv,I have watched this scene so many times but the first time I actually got the joke. The show keeps giving and giving!,t3_h00954,/r/DunderMifflin/comments/h00954/no_matter_how_many_times_i_see_it_makes_me_laugh/ftk2vvv/,11,DunderMifflin,comment,2020-06-10
1154,Dylan-Wertzler,1591767261,ftk2x3b,It is happening this year there is a new nbc app called peacock or something,t1_ftjz8xb,/r/DunderMifflin/comments/h03m1n/neflix_account_is_gonna_go_bye_bye/ftk2x3b/,2,DunderMifflin,comment,2020-06-10
1155,SuperMcG,1591767292,ftk2yjv,"This is me! After years on this sub... finally watching it. At S2, E9.",t3_gzsvva,/r/DunderMifflin/comments/gzsvva/maybe_someday/ftk2yjv/,1,DunderMifflin,comment,2020-06-10
1156,ReelSteele27,1591767362,ftk31sg,"I honestly wonder why you people even browse this sub, if you hate the protagonists that much",t1_ftjlbfr,/r/DunderMifflin/comments/h00ecn/hey_thats_tomorrow_cheers_to_the_almost_wedding/ftk31sg/,2,DunderMifflin,comment,2020-06-10
1157,smalltownamerica,1591767385,ftk32wi,was just about to post the same thing! it’s call of duty :),t1_ftgd00u,/r/DunderMifflin/comments/gzhjks/season_2_episode_9_what_game_is_toby_playing_on/ftk32wi/,2,DunderMifflin,comment,2020-06-10
1158,mytwoquarters,1591767386,ftk32y8,But it's their job to almost die getting the perfect shot lol,t1_ftjn7u7,/r/DunderMifflin/comments/gzy9w3/lets_just_see_where_this_goes/ftk32y8/,2,DunderMifflin,comment,2020-06-10
1159,Apostinggod,1591767626,ftk3dw2,That would imply we were holding onto something we worked really hard on.  I'm not buying it.,t3_gzwghz,/r/DunderMifflin/comments/gzwghz/poor_kev/ftk3dw2/,1,DunderMifflin,comment,2020-06-10
1160,F0restf1re,1591767720,ftk3ibj,"Whatever, we still enjoy seeing it. What’s your problem bot. One of the great things about the Office is how you can watch it over and over, thus look at the same jokes over and over",t1_ftjjh5n,/r/DunderMifflin/comments/h00954/no_matter_how_many_times_i_see_it_makes_me_laugh/ftk3ibj/,-14,DunderMifflin,comment,2020-06-10
1161,HalpertsLeftNut,1591767731,ftk3itb,Plomp isn’t as good as Clarmk,t3_h04k4l,/r/DunderMifflin/comments/h04k4l/plomp_really_is_the_new_jim/ftk3itb/,3,DunderMifflin,comment,2020-06-10
1162,ReelSteele27,1591767744,ftk3jek,I am not a bad person. I am a good person who runs over women with his car.,t3_h02ydh,/r/DunderMifflin/comments/h02ydh/minor_flaws/ftk3jek/,2,DunderMifflin,comment,2020-06-10
