,author,created_utc,id,body,parent_id,permalink,score,subreddit,ptype,time
540,AutoModerator,1596950949,g0v5y0m,"Hey Sack_of_yams! Your submission has been automatically removed due to a minimum age requirement on your Reddit account. Your account must be at least 1 day old to post to the subreddit.

*I am a bot, and this action was performed automatically. Please [contact the moderators of this subreddit](/message/compose/?to=/r/DunderMifflin) if you have any questions or concerns.*",t3_i6e3vk,/r/DunderMifflin/comments/i6e3vk/why_does_the_bathroom_in_the_corporate_office/g0v5y0m/,1,DunderMifflin,comment,2020-08-09
541,DopeCajun,1596951064,g0v639o,The fact that she deprived Dwight from his son and Philip from his father for years while anotjer man raised the child made me not like Angela. In fact i think she is evil.,t3_i6dcxg,/r/DunderMifflin/comments/i6dcxg/i_love_rainn_wilsons_acting_here_this_scene_never/g0v639o/,1,DunderMifflin,comment,2020-08-09
542,Daisyyyyyyythedog,1596951071,g0v63ki,"Oh, it’s on.",t1_g0v4kq5,/r/DunderMifflin/comments/i68f3q/saw_this_a_long_time_ago_but_couldnt_find_it_so_i/g0v63ki/,1,DunderMifflin,comment,2020-08-09
543,NunYaBizznuz,1596951088,g0v64ad,you’re welcome :),t1_g0v5qp3,/r/DunderMifflin/comments/i632ee/i_spent_a_long_time_on_this_lol_i_hope_yall_like/g0v64ad/,1,DunderMifflin,comment,2020-08-09
544,ridiculousdisaster,1596951139,g0v66qo,"Tell her you want to get it ""just in case"" 😬",t3_i682eu,/r/DunderMifflin/comments/i682eu/saw_this_at_a_grocery_store_i_wanted_to_buy_it/g0v66qo/,1,DunderMifflin,comment,2020-08-09
545,pfaffenbruian_5,1596951213,g0v6a64,"5,000 cases in a country of 325 mil is an epidemic?",t3_i632ee,/r/DunderMifflin/comments/i632ee/i_spent_a_long_time_on_this_lol_i_hope_yall_like/g0v6a64/,1,DunderMifflin,comment,2020-08-09
546,NunYaBizznuz,1596951229,g0v6av2,ahh thank you i tried 🥺🥺🥺,t1_g0uo2c8,/r/DunderMifflin/comments/i632ee/i_spent_a_long_time_on_this_lol_i_hope_yall_like/g0v6av2/,1,DunderMifflin,comment,2020-08-09
547,NunYaBizznuz,1596951276,g0v6cyc,BEJXBJSNENDN IDK WHAT TO SAY. THIS IS THE HIGHEST HONOR,t1_g0ux64v,/r/DunderMifflin/comments/i632ee/i_spent_a_long_time_on_this_lol_i_hope_yall_like/g0v6cyc/,1,DunderMifflin,comment,2020-08-09
548,Zapatogirl70,1596951496,g0v6mzd,This was awesome! Thanks!,t3_i632ee,/r/DunderMifflin/comments/i632ee/i_spent_a_long_time_on_this_lol_i_hope_yall_like/g0v6mzd/,1,DunderMifflin,comment,2020-08-09
549,daboss6595,1596951505,g0v6nc8,Quality assurance manager,t3_i6e77o,/r/DunderMifflin/comments/i6e77o/so_close/g0v6nc8/,1,DunderMifflin,comment,2020-08-09
550,NunYaBizznuz,1596951627,g0v6stm,no problem! just happy to make people smile :)),t1_g0v6mzd,/r/DunderMifflin/comments/i632ee/i_spent_a_long_time_on_this_lol_i_hope_yall_like/g0v6stm/,1,DunderMifflin,comment,2020-08-09
551,imbadatnames19,1596951686,g0v6vfh,When I first read this I thought you meant the actress was married to Brian Baumgartner and I was shocked.,t1_g0uwavn,/r/DunderMifflin/comments/i6bc7y/lets_be_honest/g0v6vfh/,1,DunderMifflin,comment,2020-08-09
552,elizalemon,1596951799,g0v70if,"Mary-Louise Parker is great, but she’s not Jenny or the glove lady. She’s also 14 years older than this woman. She’s no old hag or anything, but she’s had a long career.",t1_g0v50ug,/r/DunderMifflin/comments/i6bc7y/lets_be_honest/g0v70if/,1,DunderMifflin,comment,2020-08-09
553,pox_demon,1596951984,g0v78oz,"Ahhh, the Antichrist",t3_i6bbqo,/r/DunderMifflin/comments/i6bbqo/its_unholy_presenting_tochael_micby/g0v78oz/,1,DunderMifflin,comment,2020-08-09
554,do_it_rawdog,1596951991,g0v78zc,And that's why you'll never see a show with writing this good ever again,t3_i69zkb,/r/DunderMifflin/comments/i69zkb/this_buzzfeed_journalist_failed_to_understand_the/g0v78zc/,1,DunderMifflin,comment,2020-08-09
555,toilinsoil705,1596952038,g0v7b19,"""See ya later warehouse...catch you on the flippity flip!!""",t3_i6e7qp,/r/DunderMifflin/comments/i6e7qp/30_for_30_michael_scott_edition/g0v7b19/,1,DunderMifflin,comment,2020-08-09
556,talkshowdiva,1596952119,g0v7ep2,Dwight’s “GET OUUUUT!” will forever bring me joy....he’s a dad! 😁,t3_i6dcxg,/r/DunderMifflin/comments/i6dcxg/i_love_rainn_wilsons_acting_here_this_scene_never/g0v7ep2/,1,DunderMifflin,comment,2020-08-09
557,elijahsmith2006,1596952183,g0v7hjb,This is horrible!,t3_i6eaq7,/r/DunderMifflin/comments/i6eaq7/whats_wrong_with_some_of_these_people/g0v7hjb/,1,DunderMifflin,comment,2020-08-09
558,Arct_Pyro,1596952187,g0v7hpe,i just watched that scene!! really wholesome,t3_i6dcxg,/r/DunderMifflin/comments/i6dcxg/i_love_rainn_wilsons_acting_here_this_scene_never/g0v7hpe/,1,DunderMifflin,comment,2020-08-09
559,DrStvBrl,1596952539,g0v7wz5,Head just DM the creators of the office on nbc,t3_i6duw5,/r/DunderMifflin/comments/i6duw5/hello_everyone_this_is_my_first_post_here_and_i/g0v7wz5/,1,DunderMifflin,comment,2020-08-09
560,Solid_Solaire,1596952684,g0v83cl,"""Toilet paper: Goodbye"" is so funny😂, great job",t3_i632ee,/r/DunderMifflin/comments/i632ee/i_spent_a_long_time_on_this_lol_i_hope_yall_like/g0v83cl/,1,DunderMifflin,comment,2020-08-09
561,Sloanduet1234,1596952711,g0v84h1,The guy giving him the driving test probably thought he was really annoying and passed him anyway because he didn’t want to go through the process of a make up test,t3_i65t30,/r/DunderMifflin/comments/i65t30/true/g0v84h1/,1,DunderMifflin,comment,2020-08-09
562,Triggerhappy247,1596952776,g0v8788,Yes please OP.,t1_g0tw0f2,/r/DunderMifflin/comments/i632ee/i_spent_a_long_time_on_this_lol_i_hope_yall_like/g0v8788/,1,DunderMifflin,comment,2020-08-09
563,akinaaaaaa,1596952780,g0v87ei,Lol i live in a one bedroom apartment with 4 other people so privacy is very much nonexistent 😅,t1_g0tw35t,/r/DunderMifflin/comments/i632ee/i_spent_a_long_time_on_this_lol_i_hope_yall_like/g0v87ei/,1,DunderMifflin,comment,2020-08-09
564,NunYaBizznuz,1596952839,g0v89wz,thank you! :),t1_g0v83cl,/r/DunderMifflin/comments/i632ee/i_spent_a_long_time_on_this_lol_i_hope_yall_like/g0v89wz/,1,DunderMifflin,comment,2020-08-09
565,Makylo_ren,1596952848,g0v8aa3,This made me smile,t3_i6eabs,/r/DunderMifflin/comments/i6eabs/where_all_my_hamilton_fans_at/g0v8aa3/,1,DunderMifflin,comment,2020-08-09
566,Bansharee,1596952897,g0v8ceh,This is good! 😂👏🏻,t3_i6eabs,/r/DunderMifflin/comments/i6eabs/where_all_my_hamilton_fans_at/g0v8ceh/,1,DunderMifflin,comment,2020-08-09
567,BooksBearsBeets,1596952933,g0v8dyc,"“And that kids, is how I met your mother.” - how it should have ended",t3_i6bc7y,/r/DunderMifflin/comments/i6bc7y/lets_be_honest/g0v8dyc/,1,DunderMifflin,comment,2020-08-09
568,qtabib,1596953059,g0v8jce,u/redditspeedbot 1x,t3_i632ee,/r/DunderMifflin/comments/i632ee/i_spent_a_long_time_on_this_lol_i_hope_yall_like/g0v8jce/,1,DunderMifflin,comment,2020-08-09
569,blitzskrieg,1596953106,g0v8lcr,"Hate the character, respect the actor.

Things I learnt from GoT.",t3_i6eaq7,/r/DunderMifflin/comments/i6eaq7/whats_wrong_with_some_of_these_people/g0v8lcr/,1,DunderMifflin,comment,2020-08-09
570,[deleted],1596953150,g0v8n6l,[removed],t3_i632ee,/r/DunderMifflin/comments/i632ee/i_spent_a_long_time_on_this_lol_i_hope_yall_like/g0v8n6l/,1,DunderMifflin,comment,2020-08-09
571,carldaveson123,1596953192,g0v8oyo,Number 10 Burger King foot Lettuce,t3_i6c0sb,/r/DunderMifflin/comments/i6c0sb/no_jim_noooo/g0v8oyo/,1,DunderMifflin,comment,2020-08-09
572,Killmonger18,1596953398,g0v8xyy,"You have no idea how happy that makes me, thank you for saying that. Have a great day.",t1_g0v8aa3,/r/DunderMifflin/comments/i6eabs/where_all_my_hamilton_fans_at/g0v8xyy/,1,DunderMifflin,comment,2020-08-09
573,Vikash22,1596953414,g0v8yo5,You're welcome,t1_g0t45zd,/r/DunderMifflin/comments/i45uac/happy_25th_marriage_anniversary_to_steve_carell/g0v8yo5/,1,DunderMifflin,comment,2020-08-09
574,[deleted],1596953417,g0v8ys6,[removed],t1_g0v8jce,/r/DunderMifflin/comments/i632ee/i_spent_a_long_time_on_this_lol_i_hope_yall_like/g0v8ys6/,1,DunderMifflin,comment,2020-08-09
575,Killmonger18,1596953437,g0v8zni,"Thank you, if I'm honest, I thought too much about it for it to go unnoticed 😂",t1_g0v8ceh,/r/DunderMifflin/comments/i6eabs/where_all_my_hamilton_fans_at/g0v8zni/,1,DunderMifflin,comment,2020-08-09
576,PARTYxBOBSWRSKI,1596953452,g0v90ad,Can you elaborate? I was thinking about listening,t3_i6ek21,/r/DunderMifflin/comments/i6ek21/i_wish_i_could_go_back_to_the_time_before_i_heard/g0v90ad/,1,DunderMifflin,comment,2020-08-09
577,bookreader018,1596953469,g0v90z8,absolutely sent me,t1_g0tge8k,/r/DunderMifflin/comments/i632ee/i_spent_a_long_time_on_this_lol_i_hope_yall_like/g0v90z8/,1,DunderMifflin,comment,2020-08-09
578,Skollgrimm,1596953481,g0v91je,Keep your equipmunk safe.,t1_g0uwavn,/r/DunderMifflin/comments/i6bc7y/lets_be_honest/g0v91je/,1,DunderMifflin,comment,2020-08-09
579,SteamrockFever,1596953524,g0v93ck,Me trying to remember who directed Pulp Fiction,t3_i6e77o,/r/DunderMifflin/comments/i6e77o/so_close/g0v93ck/,1,DunderMifflin,comment,2020-08-09
580,wawedewawe,1596953547,g0v94bo,What about Meredith?,t3_i632ee,/r/DunderMifflin/comments/i632ee/i_spent_a_long_time_on_this_lol_i_hope_yall_like/g0v94bo/,1,DunderMifflin,comment,2020-08-09
581,a-thang,1596953581,g0v95qd,Best Video Ever.,t3_i632ee,/r/DunderMifflin/comments/i632ee/i_spent_a_long_time_on_this_lol_i_hope_yall_like/g0v95qd/,1,DunderMifflin,comment,2020-08-09
582,DarthSnoopyFish,1596953586,g0v95xt,What did you do tonight. Yell at some people on your lawn?,t1_g0u8uqt,/r/DunderMifflin/comments/i632ee/i_spent_a_long_time_on_this_lol_i_hope_yall_like/g0v95xt/,1,DunderMifflin,comment,2020-08-09
583,codysl599,1596953597,g0v96d7,Please do,t1_g0v90ad,/r/DunderMifflin/comments/i6ek21/i_wish_i_could_go_back_to_the_time_before_i_heard/g0v96d7/,1,DunderMifflin,comment,2020-08-09
584,Narrew82,1596953602,g0v96kt,Chair model office catalog girl: *am I joke to you?*,t3_i6bc7y,/r/DunderMifflin/comments/i6bc7y/lets_be_honest/g0v96kt/,1,DunderMifflin,comment,2020-08-09
585,yinyangmel,1596953604,g0v96p0,Watch it a couple more times and you just might stop liking the Jim and Pam thing lol.,t3_i6egoo,/r/DunderMifflin/comments/i6egoo/i_just_started_watching_the_office/g0v96p0/,1,DunderMifflin,comment,2020-08-09
586,dwide_k_shrude,1596953619,g0v97au,Your art is the prettiest art of all the art.,t1_g0tt11h,/r/DunderMifflin/comments/i632ee/i_spent_a_long_time_on_this_lol_i_hope_yall_like/g0v97au/,1,DunderMifflin,comment,2020-08-09
587,mikechr2k7,1596953740,g0v9cct,"Shes fine, I do find myself liking Angela more ironically",t3_i6ek21,/r/DunderMifflin/comments/i6ek21/i_wish_i_could_go_back_to_the_time_before_i_heard/g0v9cct/,1,DunderMifflin,comment,2020-08-09
588,justthison,1596953864,g0v9hls,"If you’re an office fan, it’s probably still worth a listen. It’s just that in the early episodes Jenna is *extremely* condescending and rude towards Angela in a way that is hard to ignore. She gets better about it after a few episodes, but it’s hard not to hear Jenna holding herself back from the barbs she wants to throw, if that makes sense. It sounds like she heard the negative feedback about her attitude and is trying hard not to be that way, but “that way” is just her natural self. Watching the office now feels like watching Jenna instead of Pam, bc I guess I let it get to me too much. 

That being said, the podcast still has a ton of great nuggets. It’s just that the Pam character is ruined for me now.",t1_g0v90ad,/r/DunderMifflin/comments/i6ek21/i_wish_i_could_go_back_to_the_time_before_i_heard/g0v9hls/,1,DunderMifflin,comment,2020-08-09
589,MrFeeney33,1596953926,g0v9k7n,"Man, I'll never forget how Stephen Rannazzisi admitted that he lied about his story that he was in the World Trade Center on 9/11 when the first plane hit. That is some crazy shit.",t1_g0uq38i,/r/DunderMifflin/comments/i6bc7y/lets_be_honest/g0v9k7n/,1,DunderMifflin,comment,2020-08-09
590,trunkspop,1596953989,g0v9mvm,I wish they dropped a behind the scenes footage of those pigeons whether it was intentional or not,t3_i68f3q,/r/DunderMifflin/comments/i68f3q/saw_this_a_long_time_ago_but_couldnt_find_it_so_i/g0v9mvm/,1,DunderMifflin,comment,2020-08-09
591,Holy_Sungaal,1596953991,g0v9mza,"Wait? That’s the chick that played a character trying to get with Jim and people are saying shit in real life, like she’s her character?",t3_i6eaq7,/r/DunderMifflin/comments/i6eaq7/whats_wrong_with_some_of_these_people/g0v9mza/,1,DunderMifflin,comment,2020-08-09
592,wetweeb68,1596954001,g0v9neb,"You have committed the most heinous crime by complimenting toby, I will upvote anyway",t3_i6egoo,/r/DunderMifflin/comments/i6egoo/i_just_started_watching_the_office/g0v9neb/,1,DunderMifflin,comment,2020-08-09
593,_IAmNoLongerThere_,1596954054,g0v9pl1,Me too! After hearing a few episodes of the podcast I have come to love Angela,t1_g0v9cct,/r/DunderMifflin/comments/i6ek21/i_wish_i_could_go_back_to_the_time_before_i_heard/g0v9pl1/,1,DunderMifflin,comment,2020-08-09
594,abcris7,1596954218,g0v9weq,And also shows the office relationship where they understood this was the first time michael had felt any connection to a woman since Holly and tried to encourage him.,t1_g0usj0v,/r/DunderMifflin/comments/i6bc7y/lets_be_honest/g0v9weq/,1,DunderMifflin,comment,2020-08-09
595,Chalupa_Dad,1596954280,g0v9yzc,I just watched this today! And was thinking of what a shame it was we never saw her again...but also realistic to how things go in the regular life,t3_i6bc7y,/r/DunderMifflin/comments/i6bc7y/lets_be_honest/g0v9yzc/,1,DunderMifflin,comment,2020-08-09
596,That1Wolf,1596954490,g0va7je,"My only question to you is why, why did you do this?",t3_i6b5l1,/r/DunderMifflin/comments/i6b5l1/lloyd_gross_or_dwim_as_i_call_him/g0va7je/,1,DunderMifflin,comment,2020-08-09
597,That1Wolf,1596954500,g0va7xu,Happy cake day!,t1_g0ult47,/r/DunderMifflin/comments/i6b5l1/lloyd_gross_or_dwim_as_i_call_him/g0va7xu/,1,DunderMifflin,comment,2020-08-09
598,lacowcow,1596954502,g0va813,https://youtu.be/GXFSK0ogeg4 im pretty sure it’s this one.,t3_i6eqea,/r/DunderMifflin/comments/i6eqea/whats_the_name_of_the_song_that_plays_when_dwight/g0va813/,1,DunderMifflin,comment,2020-08-09
599,shadowpanther21,1596954503,g0va81i,Can you elaborate a bit more? I thought Jenna and Angela were best friends irl. What is she saying exactly to treat her poorly?,t1_g0v9hls,/r/DunderMifflin/comments/i6ek21/i_wish_i_could_go_back_to_the_time_before_i_heard/g0va81i/,1,DunderMifflin,comment,2020-08-09
600,Cademan7308,1596084588,fzp6h8o,Correct,t3_i0fvpv,/r/DunderMifflin/comments/i0fvpv/so_dwights_nephew_went_on_the_hay_ride_at_hay/fzp6h8o/,3,DunderMifflin,comment,2020-07-30
601,ltew95,1596084591,fzp6hdy,Are you a 12 year old? Millennials currently make up 50% of the American workforce and are projected to make up 75% of it by 2025.,t1_fzoiu3l,/r/DunderMifflin/comments/i0abha/damnit_michael/fzp6hdy/,5,DunderMifflin,comment,2020-07-30
602,Cademan7308,1596084643,fzp6k0g,Dwight and Pam,t3_i0fqyv,/r/DunderMifflin/comments/i0fqyv/favorite_relationships_on_the_show/fzp6k0g/,2,DunderMifflin,comment,2020-07-30
603,housevil,1596084661,fzp6kve,"I've already downloaded The Office: Extended, so I'm good.",t3_i0fst2,/r/DunderMifflin/comments/i0fst2/finding_out_everyday_is_one_day_closer_till_the/fzp6kve/,3,DunderMifflin,comment,2020-07-30
604,koukijimbob,1596084823,fzp6sus,"In my haste I missed your purple instead of people anyway, so we all make mistakes apparently lol",t1_fzp5u9b,/r/DunderMifflin/comments/i0a02a/the_most_exclusive_club/fzp6sus/,3,DunderMifflin,comment,2020-07-30
605,bloodredcookie,1596084861,fzp6uq8,But then Andy would join...,t1_fzoyoaa,/r/DunderMifflin/comments/i0a02a/the_most_exclusive_club/fzp6uq8/,1,DunderMifflin,comment,2020-07-30
606,JeanValJohnFranco,1596084885,fzp6vve,Mischief. Mayhem. Sophie’s Choice.,t1_fzo1otn,/r/DunderMifflin/comments/i0a02a/the_most_exclusive_club/fzp6vve/,1,DunderMifflin,comment,2020-07-30
607,drfunkenstien014,1596085137,fzp7872,"I do not like the Office. However, this episode is up there with the German’s episode from Faulty Towers. It is one of the funniest things I have ever seen and it’s been over a decade since I’ve seen it.",t3_i0a02a,/r/DunderMifflin/comments/i0a02a/the_most_exclusive_club/fzp7872/,1,DunderMifflin,comment,2020-07-30
608,[deleted],1596085187,fzp7an9,[removed],t3_i0ftgc,/r/DunderMifflin/comments/i0ftgc/i_enjoyed_gabe_lewis/fzp7an9/,1,DunderMifflin,comment,2020-07-30
609,michael-g-scott-bot,1596085205,fzp7bhc,This is an environment of welcoming and you should just get the hell out of here.,t1_fzp5rpy,/r/DunderMifflin/comments/i0fst2/finding_out_everyday_is_one_day_closer_till_the/fzp7bhc/,3,DunderMifflin,comment,2020-07-30
610,BrattonCreedThoughts,1596085208,fzp7bo5,Omg! How did i not notice this? On which rerun were you at when you discovered this?,t3_i0acwd,/r/DunderMifflin/comments/i0acwd/is_it_just_me_or_does_erin_look_a_lot_like/fzp7bo5/,2,DunderMifflin,comment,2020-07-30
611,howtheturntables07,1596085233,fzp7cv3,This is more cringey than Scott’s Tots imo.,t1_fzo0qwl,/r/DunderMifflin/comments/i03le6/never_forget_the_dude/fzp7cv3/,2,DunderMifflin,comment,2020-07-30
612,marie4212,1596085254,fzp7dv4,She kind of reminds me of this girl I saw at the coacherrella last year when Zooey Dischannel was performing.,t3_i0acwd,/r/DunderMifflin/comments/i0acwd/is_it_just_me_or_does_erin_look_a_lot_like/fzp7dv4/,3,DunderMifflin,comment,2020-07-30
613,myakitty,1596085255,fzp7dxy,"... no you’re not. You’re not a liar too, are you?",t1_fzp5jtr,/r/DunderMifflin/comments/i0b8w5/liar/fzp7dxy/,1,DunderMifflin,comment,2020-07-30
614,BrattonCreedThoughts,1596085304,fzp7g7z,I never seen her play ping pong actually,t1_fzokwss,/r/DunderMifflin/comments/i0acwd/is_it_just_me_or_does_erin_look_a_lot_like/fzp7g7z/,2,DunderMifflin,comment,2020-07-30
615,beautifulcreature86,1596085384,fzp7k1y,He got fired for helping,t1_fzp2x3e,/r/DunderMifflin/comments/i0688k/this_is_about_doing_not_thinking/fzp7k1y/,1,DunderMifflin,comment,2020-07-30
616,Jupiter68128,1596085421,fzp7lvw,Stop talking about it,t3_i0ft0b,/r/DunderMifflin/comments/i0ft0b/false_this_is_the_most_exclusive_club/fzp7lvw/,2,DunderMifflin,comment,2020-07-30
617,jimmyjrdanceparty,1596085431,fzp7mbd,"Because there's no reason to say they ""clearly"" aren't original just because there's a sub listed on their profile that they clarified they don't even visit. That isn't an indicator of their personality.",t1_fzp66mo,/r/DunderMifflin/comments/i0a02a/the_most_exclusive_club/fzp7mbd/,1,DunderMifflin,comment,2020-07-30
618,[deleted],1596085537,fzp7rf7,[removed],t3_i0fi7a,/r/DunderMifflin/comments/i0fi7a/oh_no_dwight/fzp7rf7/,1,DunderMifflin,comment,2020-07-30
619,Inkypencilol,1596085676,fzp7xws,"it’s not just that, it’s also the fact they made an unoriginal joke. you can’t call out people for making unoriginal jokes and then make unoriginal jokes.",t1_fzp7mbd,/r/DunderMifflin/comments/i0a02a/the_most_exclusive_club/fzp7xws/,1,DunderMifflin,comment,2020-07-30
620,TheAirNomad11,1596085715,fzp7zts,"My name is Tony.

Did you just mess up your own name?",t1_fzoruu2,/r/DunderMifflin/comments/i0a02a/the_most_exclusive_club/fzp7zts/,3,DunderMifflin,comment,2020-07-30
621,saddgyal,1596085806,fzp843a,Him walking out of the conference room after crying is my favourite Gabe moment,t3_i0ftgc,/r/DunderMifflin/comments/i0ftgc/i_enjoyed_gabe_lewis/fzp843a/,4,DunderMifflin,comment,2020-07-30
622,Pronflex,1596085916,fzp89b6,"Well it’s the fault of everyone who votes in politicians increasing government spending, not just the boomers",t3_i0abha,/r/DunderMifflin/comments/i0abha/damnit_michael/fzp89b6/,1,DunderMifflin,comment,2020-07-30
623,Dairedaii,1596085927,fzp89q4,Just saw that Toby did too for social work,t3_hx7env,/r/DunderMifflin/comments/hx7env/which_office_characters_went_to_college/fzp89q4/,1,DunderMifflin,comment,2020-07-30
624,underwlrdpriest,1596086003,fzp8d7y,"stanley, creed, meridith and darryl are some of the best characters in the show. if the show ran longer i would have like to see less focus on pam and jim, and more on the other characters, or at least a balance.",t1_fzo7we3,/r/DunderMifflin/comments/hwtxmr/we_did_it_family_uncle_stan_is_now_100_funded/fzp8d7y/,1,DunderMifflin,comment,2020-07-30
625,daboss6595,1596086067,fzp8g3c,It’s sab-ray,t3_i0g8ey,/r/DunderMifflin/comments/i0g8ey/sabre_or_sabre/fzp8g3c/,1,DunderMifflin,comment,2020-07-30
626,livinlavida_coco,1596086087,fzp8h0r,andy in ally sheedy’s spot. 😹😹😹,t3_i0en77,/r/DunderMifflin/comments/i0en77/inspired_by_the_recent_fight_club_post/fzp8h0r/,2,DunderMifflin,comment,2020-07-30
627,[deleted],1596086107,fzp8hv9,[removed],t1_fzoumok,/r/DunderMifflin/comments/i0a02a/the_most_exclusive_club/fzp8hv9/,1,DunderMifflin,comment,2020-07-30
628,GeldKatze,1596086120,fzp8ihg,Netflix declares bankruptcy!,t3_i0fst2,/r/DunderMifflin/comments/i0fst2/finding_out_everyday_is_one_day_closer_till_the/fzp8ihg/,9,DunderMifflin,comment,2020-07-30
629,JJyaz7,1596086180,fzp8l9v,yes but in the show seasons 1-6 they didn’t have much plots,t1_fzp8d7y,/r/DunderMifflin/comments/hwtxmr/we_did_it_family_uncle_stan_is_now_100_funded/fzp8l9v/,1,DunderMifflin,comment,2020-07-30
630,rejected_head,1596086211,fzp8mml,My dream of joining this club will never come true,t3_i0a02a,/r/DunderMifflin/comments/i0a02a/the_most_exclusive_club/fzp8mml/,1,DunderMifflin,comment,2020-07-30
631,tefcm,1596086333,fzp8s1u,Isn't that supposed to be Toby's car and that's part of the theory as to why Toby is the killer?,t3_i0g9m6,/r/DunderMifflin/comments/i0g9m6/the_scranton_strangler_was_at_dunder_mifflin/fzp8s1u/,12,DunderMifflin,comment,2020-07-30
632,[deleted],1596086576,fzp937d,[removed],t3_i0a02a,/r/DunderMifflin/comments/i0a02a/the_most_exclusive_club/fzp937d/,1,DunderMifflin,comment,2020-07-30
633,137free,1596086594,fzp941a,I never hated Toby that much but this photo of his face makes me hate him a little,t3_i0a02a,/r/DunderMifflin/comments/i0a02a/the_most_exclusive_club/fzp941a/,1,DunderMifflin,comment,2020-07-30
634,e_gadd,1596086661,fzp96yh,Streaming it on the 'cock will be even better!,t3_i0fst2,/r/DunderMifflin/comments/i0fst2/finding_out_everyday_is_one_day_closer_till_the/fzp96yh/,2,DunderMifflin,comment,2020-07-30
635,publicenemyone,1596086681,fzp97ui,I’m loving the Scott’s Tots appreciation,t3_i0cj6i,/r/DunderMifflin/comments/i0cj6i/best_and_worst_episode_of_each_season/fzp97ui/,1,DunderMifflin,comment,2020-07-30
636,sweetgrenadine,1596086682,fzp97xa,"Love this moment. When he pauses and does the complete character change, gets me every time",t3_i0d3vd,/r/DunderMifflin/comments/i0d3vd/my_favorite_andymichael_scene_is_the_one_with_the/fzp97xa/,3,DunderMifflin,comment,2020-07-30
637,ghoulbug,1596086707,fzp992y,"This is a really clever thing they did— not only is it hilarious and fitting that Angela Martin has her purse in her lap and a pillow between herself and another guest, it's also helping at some angles to hide the fact that Angela Kinsey was extremely pregnant during this filming. If you rewatch the episode with this in mind, the camera angles and things they put between Angela's lower torso and the camera are very skillfully done.",t3_i0gaog,/r/DunderMifflin/comments/i0gaog/i_dont_know_if_this_has_been_pointed_out_in_the/fzp992y/,11,DunderMifflin,comment,2020-07-30
638,RingedAsh,1596086738,fzp9ahw,"I think Oscar was messing with him. Or since Michael has never said rundown, he probably called it a list of clients, they didn’t know the terminology. I like to believe the former",t1_fzp53nn,/r/DunderMifflin/comments/i0dzsy/you_got_that_rundown_for_me_jim/fzp9ahw/,2,DunderMifflin,comment,2020-07-30
639,RayLiottasCheeks,1596086816,fzp9e0i,what gives you the right,t1_fzovc51,/r/DunderMifflin/comments/i0a02a/the_most_exclusive_club/fzp9e0i/,7,DunderMifflin,comment,2020-07-30
640,Dispositionpsn,1596086818,fzp9e2i,"Toby is the Scranton Strangler.  It's why he felt so bad sending that innocent man to jail.  That's why he had to go there and apologize, which he confessed to him, he's the Strangler.  George Howard Skub was so angry, he strangled Toby.",t3_i0g9m6,/r/DunderMifflin/comments/i0g9m6/the_scranton_strangler_was_at_dunder_mifflin/fzp9e2i/,11,DunderMifflin,comment,2020-07-30
641,GameCraftBuild,1596086852,fzp9foy,😂 petty to the very end. Also love how they managed to hide the actresses pregnant belly behind that convenient purse,t3_i0gaog,/r/DunderMifflin/comments/i0gaog/i_dont_know_if_this_has_been_pointed_out_in_the/fzp9foy/,6,DunderMifflin,comment,2020-07-30
642,sweetgrenadine,1596086936,fzp9jh6,"I agree. Love the Glee episode at his apartment “here’s what’s been done, start creating.” 
Also got some solid backstory for his Asian fetish",t3_i0ftgc,/r/DunderMifflin/comments/i0ftgc/i_enjoyed_gabe_lewis/fzp9jh6/,3,DunderMifflin,comment,2020-07-30
643,daboss6595,1596086943,fzp9js0,And creed during the savanna episode,t3_i0geg6,/r/DunderMifflin/comments/i0geg6/just_act_normal_they_will_go_away/fzp9js0/,1,DunderMifflin,comment,2020-07-30
644,JackOfFarts69,1596086970,fzp9kyf,DID I STUTTER ?,t3_i0fzwl,/r/DunderMifflin/comments/i0fzwl/when_netflix_takes_off_the_office/fzp9kyf/,3,DunderMifflin,comment,2020-07-30
645,rebeard-artworks,1596087054,fzp9oqk,Clumsy displays of ziplining too.,t1_fzojo0g,/r/DunderMifflin/comments/i0a02a/the_most_exclusive_club/fzp9oqk/,2,DunderMifflin,comment,2020-07-30
646,mostlylurkingg,1596087169,fzp9tuq,"The more I rewatch the show, the more I like him

He plays his role well",t3_i0ftgc,/r/DunderMifflin/comments/i0ftgc/i_enjoyed_gabe_lewis/fzp9tuq/,3,DunderMifflin,comment,2020-07-30
647,greenfingers559,1596087267,fzp9yd6,"Or is it the other way around. Remember the night at Robert California's mansion. Toby and Oscar are drinking together and Toby says to the camera ""youre playing a dangerous game Toby""",t1_fzodjp3,/r/DunderMifflin/comments/i0a02a/the_most_exclusive_club/fzp9yd6/,2,DunderMifflin,comment,2020-07-30
